job_id,job_title,job_organization_name,job_snippet_text,source_url,job_search_term,location_search_term,full_url
391a6cf840475e06ff7baa4a7835d3be,IT SPECIALIST (NETWORK) (Title 5),Air National Guard Units,b'This position is covered by the Domestic Violence Misdemeanor Amendment (30 Sep 96) of the Gun Control Act (Lautenberg Amendment) of 1968. An individual convicted of a qualifying crime of domestic...',https://www.ziprecruiter.com/candidate/search?search=misdemeanor&location=illinois,misdemeanor,illinois,https://www.ziprecruiter.com/k/l/AAJycI0mPfvW4a3BwAFpU92T1vrbz6j1-q_vW0fItPFRpI7yGna5Y_xyjNdtNe8n9Lggv_qS6POyqJI3soBAC_fClEpLRBJ_kA7lCw0syQzNLw-TirnhyU_LhbW_wf8CKU2BMWApe1n68DxXWfc3eDt57HQkJuPGP08Ag7rViWpetF_beSCPLd7L85klETM
4531e5da1cdbc1e1c0dba2bdd19b2e31,SMALL ARMS REPAIRER (Title 32),Army National Guard Units,b'This position is covered by the Domestic Violence Misdemeanor Amendment (30 Sep 96) of the Gun Control Act (Lautenberg Amendment) of 1968. An individual convicted of a qualifying crime of domestic...',https://www.ziprecruiter.com/candidate/search?search=misdemeanor&location=illinois,misdemeanor,illinois,https://www.ziprecruiter.com/k/l/AAKnc-gumZ09IwCK4gHIeqfMLrnWHaEoqY7dHrk7NQdhb6xOh9WemVlBICja4ocbXNZjqlEbtiQxxqkuUiuP4T7_f1N3Eo8t6SJPakwZVkspan7yxqd_sFQGuwdxpATNi6DCOyMBFNQGSG-mNFYK70L_pr0V3ydEgrL_E_st47qoOJ0sYrjTBnJrQXo-AP0
ab7ac5381616c53ec66785b32b19ac7f,SAFETY AND OCCUPATIONAL HEALTH MANAGER (Title 32),Air National Guard Units,b'This position is covered by the Domestic Violence Misdemeanor Amendment (30 Sep 96) of the Gun Control Act (Lautenberg Amendment) of 1968. An individual convicted of a qualifying crime of domestic...',https://www.ziprecruiter.com/candidate/search?search=misdemeanor&location=illinois,misdemeanor,illinois,https://www.ziprecruiter.com/k/l/AAIQiPsDSEI31aNV1752FX7AFHSE2bkZgbj0MbNEIc4QjL_wCKwGW5xblaS8AoqLhE0VQm-WMPah7cvbhSUzE8S6eP70pqNzr9F65ZoWbZN7Cmf1braosz-BotLXjCuHCEkr_c1_zXHbQt25pSCjcgMhh1PHA9t1XE1J9qqiiVc6RxXyZjq5sdmgFIHqv3Y
c111db3591487465856e1699fd91e94d,SELF-ASSESSMENT MONITOR (Title 32),Air National Guard Units,b'This position is covered by the Domestic Violence Misdemeanor Amendment (30 Sep 96) of the Gun Control Act (Lautenberg Amendment) of 1968. An individual convicted of a qualifying crime of domestic...',https://www.ziprecruiter.com/candidate/search?search=misdemeanor&location=illinois,misdemeanor,illinois,https://www.ziprecruiter.com/k/l/AALVuOWiZT4nVbMaBp0vJmnu_waudyUbtGEB1Koo7_eCm2sU5LzsQngj97VLxOr_SV3gaarzD6iLuz8xwxU_ZAcPRqXyrSxCaX1ybI9moKzlc6LpF--UgkqWyc1Fx7U1E2Ur3l4nqzTuoTsD45gBNsStaSgXRSnEZ9nY5Yi7q_ChqxkwKXK8pu7klW9MQ3M2
1354dfd2df94ef3e3bb884e8a27419ab,POWERED SUPPORT SYSTEMS MECHANIC (Title 32),Air National Guard Units,b'This position is covered by the Domestic Violence Misdemeanor Amendment (30 Sep 96) of the Gun Control Act (Lautenberg Amendment) of 1968. An individual convicted of a qualifying crime of domestic...',https://www.ziprecruiter.com/candidate/search?search=misdemeanor&location=illinois,misdemeanor,illinois,https://www.ziprecruiter.com/k/l/AAIqpAgqfXfkaEskptTlo_ajmpzNs6Jog49zHySXw8Fk-c3hVsoQXBoAXjeNb-VibceFcyWfSTmQFZciSzxb2ampA4HiV6WudSfe5NEYLruwQavpnnQkZSVfeCZP-4XxLPAlwzqEgU1VC0duzIXJqBhotUDVGw3pHmSyP5u55fhfWhEC3nEE0nVc7q8sv8Lr
f5c5f75f6f383c805163b30cc43740f5,SUPPLY MANAGEMENT SPECIALIST (Title 32),Air National Guard Units,b'This position is covered by the Domestic Violence Misdemeanor Amendment (30 Sep 96) of the Gun Control Act (Lautenberg Amendment) of 1968. An individual convicted of a qualifying crime of domestic...',https://www.ziprecruiter.com/candidate/search?search=misdemeanor&location=illinois,misdemeanor,illinois,https://www.ziprecruiter.com/k/l/AAIepYWyCq4R3zL7jAEZnccaqUaC-KTIhw3OuuRs88bjWNQUCYumnCxAASlsbBonZqXag2WBY8u8cZDNT_dgLZIjuCdFbZnwBXBNVq70-0Xpaml2l3C8TszN-BiKHWAFMZHywmsnPjKAc1L43gKCFjpIgzYLpsQu_sDTEA1pMiRwyBNhHEtYOHbz9Cdr5KRk
6d8f9c00b05723d749462aa7ee54cc84,Materials Handler Supervisor (Warehouse Worker Foreman) UNICOR,"Justice, Bureau of Prisons/Federal Prison System",b'...misdemeanor crim',https://www.ziprecruiter.com/candidate/search?search=misdemeanor&location=illinois,misdemeanor,illinois,https://www.ziprecruiter.com/k/l/AAK6RdgthafwrTYvpGY2usGJa3zONBx4OcDvbgin1K20HnoIKASUBS7lYM8l-VvkfTKrETdH7ofGCcDMC5PsQpQGhlzZSRgYOMcw9G7sL549Ct8-rhHBcMWnjPTOq7IlygmmwSD5zI_NFeiilkCS822z1Kur4oWHORnx7JOrr2wZ_YE2Y5wIJsUCgwlj4gnl
2073e3621e6a8520288d49e6cff8e371,SUPPLY SYSTEMS ANALYST (Title 32),Air National Guard Units,b'Position is covered by the Domestic Violence Misdemeanor Amendment (30 Sep 96) of the Gun Control Act (Lautenberg Amendment) of 1968. An individual convicted of a qualifying crime of domestic...',https://www.ziprecruiter.com/candidate/search?search=misdemeanor&location=illinois,misdemeanor,illinois,https://www.ziprecruiter.com/k/l/AAI1pwbH_WppCSgLnngWiOfBoLz0Tuc1jzV0q1PRmS8ED1OvwB2XwnN417_1_rmsd_RZwR8kngtdlNW783ietD2qNIh-ylPz7OOFHCU6SQOLpbErYNLHg1Wp20Ob_t2Uz98ZVP5uCTRoKe5jB6gp4bp48_CYuCSEhbE3Uf2hEWNqcxN12Lz3k56XQ4DNXsbJ
ec2e00369ef8a7f9bb5afe856aa53816,PRODUCTION CONTROLLER (CONSTRUCTION) (Title 5),Air National Guard Units,b'Position is covered by the Domestic Violence Misdemeanor Amendment (30 Sep 96) of the Gun Control Act (Lautenberg Amendment) of 1968. An individual convicted of a qualifying crime of domestic...',https://www.ziprecruiter.com/candidate/search?search=misdemeanor&location=illinois,misdemeanor,illinois,https://www.ziprecruiter.com/k/l/AAKRHwcOTEClHknMMx_3orw6XZv1Cd5AmHD1bRwWtfzacrEoPbDOPWHJKg-SoVL3qYFybrmjbGE-A3fcPX7EP4-C15QIv7eh17FVvFdIN7dnFQF6Ng0tnV0SGcGGpArO7_T94MC2OVGDu5P9p_p-iiZXgi8yVmVD3d7J9XbhWXXFaPdYLN9e9uH4nUbMARtv
93a3f2d7e9fe2ff4746cdd13c0291693,Logistics Management Specialist (Title 5),Air National Guard Units,b'Position is covered by the Domestic Violence Misdemeanor Amendment (30 Sep 96) of the Gun Control Act (Lautenberg Amendment) of 1968. An individual convicted of a qualifying crime of domestic...',https://www.ziprecruiter.com/candidate/search?search=misdemeanor&location=illinois,misdemeanor,illinois,https://www.ziprecruiter.com/k/l/AAILn99K94dt7JZcqADOQlTTwlpEVoRIGbh--DeebMWkIvg_o6jNJedumsgoZeLdAVZ1H50TUubrljGVNm4iOOF6VGUqYge8V5nIyEnn-IwgxiHUmv9epXBrMfzSynNoB_QKDutH7H_RGZ_q-riuhcn6p0q0fdhEflDMOVGiFIhl8eZqaOS0qfYrLroZ1R8g
e9616722e21d5aca25d3061bdeb0f2a5,MANAGEMENT ANALYST (Title 32),Air National Guard Units,b'This position is covered by the Domestic Violence Misdemeanor Amendment (30 Sep 96) of the Gun Control Act (Lautenberg Amendment) of 1968. An individual convicted of a qualifying crime of domestic...',https://www.ziprecruiter.com/candidate/search?search=misdemeanor&location=illinois,misdemeanor,illinois,https://www.ziprecruiter.com/k/l/AAIb3EzTgXA2Yswb4AT2EoOJ2NmuS8NnodY93qp8AZMGcmWNZlL0-NWB5-sgL73J1Rq_4jwqh9d1iJjKu3BaNk9FvXKcyghz8QRzkhpphJ4tEN2eV8XBC25kZBkieOF-9CFU6P4Q8yr-mbBE3te0qTt1h36bafNUbEEUBKD9cM0lhNvhRHQUGSRTqNItsFE7
026f787f7302e79ffbaf6fa9cccdfec9,Correctional Officer (Senior Officer Specialist),"Justice, Bureau of Prisons/Federal Prison System",b'SummaryWhy work for the Federal Bureau of Prisons? You can have a meaningful career with an agency that truly values a diverse workforce. You will find a diverse workforce employed from entry level...',https://www.ziprecruiter.com/candidate/search?search=prison&location=illinois,prison,illinois,https://www.ziprecruiter.com/k/l/AAIsH0AzQKbS1eEyYpgQQEx-OTCVi77SpeGD0zSzbmDWOZ7qj74ptrZ2XL-VUfhJG1XtdhFB7LCqznvL-UhEwotOZzNXU5jvj6NQbABoGibEjtt5TUDPEgQKOVc7UC3jFwyvswyGru8bc_Q17qJ2Jxqml3H_yqV6ZfUBNGZ7kGNv5KyfgHy9_uoq7-w-AQ
190decdf206de26643aca90cf06e8d8e,Correctional Officer (Correctional Counselor),"Justice, Bureau of Prisons/Federal Prison System",b'SummaryWhy work for the Federal Bureau of Prisons?You can have a meaningful career with an agency that truly values a diverse workforce. You will find a diverse workforce employed from entry level...',https://www.ziprecruiter.com/candidate/search?search=prison&location=illinois,prison,illinois,https://www.ziprecruiter.com/k/l/AALfPdBHj1HYP1PpH7lPhCCJUSbCiVWSCOgl40MUF3VKxzieb26DEQZvwq5Ikxmt5LZBpMQ1DX9rol8Gtf0q8ulrh_m8oQ7fmeWb-VzgxHhW_OJm5g0u748MtcrjgHCVpGYzcmb1ouX_SU0CumhlrKmr9h0YVlNsYQ4bDJs3tKNkbZGMLebLjO_msnLwaw
dd638a99fc9bd6f0d0de14999d985e72,Corrections Officer - Sheriffs Office,"Lake County, Illinois",b'...Prison Organizations. Must pass a one (1) week Direct Supervision class.Candidates who successfully complete the written test will be given further information on the testing process. Successful...',https://www.ziprecruiter.com/candidate/search?search=prison&location=illinois,prison,illinois,https://www.ziprecruiter.com/k/l/AAKfb3feG2g-Est4lNuGQnvBoSBJsdgV9E_dVJ0euQ9j7e0ErJGv5jFtbm1SZy9DhH-77XpXkbcOjIPk4EjTves99nrmDsiwPyRWf4yfgmMVHpm4edrO5RaiaMk5HU_j5mI0hFP25jsXupt1bgfhVlKMP2mQ4B3JNGBAFo16UPgP4aRGglDP47TFL7vQrA
69348b83711877dcb90530d5d0d5d5ff,"Part-time Radiology Technician, USP Marion",Global Healthcare Group,"b'United States Penitentiary and Satellite Prison Camp, 4500 Prison Road, Marion, Illinois 62959 Facility Information: The United States Penitentiary (USP) in Marion, Illinois, is a medium-security...'",https://www.ziprecruiter.com/candidate/search?search=prison&location=illinois,prison,illinois,https://www.ziprecruiter.com/k/l/AAKcVGbaN4rUChEm8pjE_pmRwV0GdyL3LjTTekM00FvafZPie_7_qYV8jHuEJ-RgLYJW-QuBqjmmIQJZREzFh_FbQGb8REY53g0nGe-MVqQTNOq5FNiSWg_fe_5YGxCiRtwhuR3s0XGOUtK8xf7bEA8Iq4GnUzBran1xm3lIq2pdvyFfSZ6wER2uK6PqkQ
54bba92da267b9b00260c195bbf3cc53,Optomerist,Dymentum Health,"b'Dymentum Health is seeking tone Optomerist Board Certified Physicians to provide services to - the United States Penitentiary and Satellite Prison Camp 4500 Prison Road Marion, Illinois 62959...'",https://www.ziprecruiter.com/candidate/search?search=prison&location=illinois,prison,illinois,https://www.ziprecruiter.com/k/l/AAIs5oqDRvQ-FMULLyNSAGNCE0akGGGEH85xlvCuOQTzn5r4-i1cVc1tAUm3oadPmTETHu8FSKyJTElCdqBgJp2UxZTzT121_9tAN_ygMIKXbAHq9IklGiOx0TVU00KYSulFag6O7ljzPupuBtxxUs4nWX5WNUEli0vvEDTeJapTLSvR6Gx9sd3tpSLS0A
78528ffd5af8dd931389895d878234af,Established Products Director of Strategic Channels,Abbvie,"b'Federal Bureau of Prisons, State Correctional institutions, County Jail systems, as well as private prisons contracted by state governments. There are currently 2.3 million inmates in the US...'",https://www.ziprecruiter.com/candidate/search?search=prison&location=illinois,prison,illinois,https://www.ziprecruiter.com/k/l/AAIR3PlOE1r9zxW8sz4ony65_NSbYALJGVWc7sC7LULrsT15fU_WiNYN9gauTTGSSUTIJ12RCYc5o-yZD6WllkNIZBLeKxH-WBA_g5oaBouHKhoaQ8HLauI-r6j8llDIKbxMR10P1aI2h6rrT3sCD5gFfcbQEejpKV7uEGuc1vwPM4rIiFatOe_Bi13oTA
3ced2af9d2c9339c1b615c7248d4d73f,Correctional Sergeant,State of Illinois,"b'...prison operation; requires thorough knowledge of institutional rules, regulations and requirements for the control of inmates; requires elementary knowledge of purposes, methods and practices of...'",https://www.ziprecruiter.com/candidate/search?search=prison&location=illinois,prison,illinois,https://www.ziprecruiter.com/k/l/AAIaSSiquxz1szNAcXCmxy-y-RHgKDi__7t5lRv9HCfVyvmHp2Gn8uBWKJkJo3wR1bA9nibZMWnhax3zq6VfdZRaY9suMSBEX5x7lgqiyKaN82ECETVVcDCklkS0HhO8aeOufvFbxlSMjz5Q-JOoUS-GKPiSj7ygSb04c4s4WnF0YhCWPGxykyM6B-4nbw
b471e0bd3642d0eac5af474d38915333,Dentist - PRN Hourly,Wellpath,"b'Functions as a consultant to the prison staff health care provider, if needed * Monitors need for dental supplies and equipment * Performs routine cleaning, restorative dentistry, and extraction of...'",https://www.ziprecruiter.com/candidate/search?search=prison&location=illinois,prison,illinois,https://www.ziprecruiter.com/ek/l/AAIWEx_VAWM2uQw2j6qlWz69tHRYX2ykbFBZ5NlsjG-LHtpwD4i6p96IMk3chVtF6qoJX8kqby9QM8P6_LGEOU-YLnY77pb2Gq2WcdwovPTostrbjBXFSMKxhcNsnok2i8e-WgmOVVCKnCx2g6YtEJVwex9SPT1oPVWvmRe5UEAVMa3iHOsDlVfEKD_rEQ
3f8645f002e39402afcbabfbc0f9fbb1,Correctional Lieutenant (Upward Mobility Target Title) (GWC),State of Illinois,"b'...prison administration; requires ability to maintain satisfactory working relationships with public officials, investigatory and law enforcement agencies; requires ability to supervise correctional...'",https://www.ziprecruiter.com/candidate/search?search=prison&location=illinois,prison,illinois,https://www.ziprecruiter.com/k/l/AALMOFS8E1H-8YlS2hfQrFrMZrIGBSPklLpDKK-sBfY-cUpqcjQykdWI6q6WkkxHx1gJKz9GEO-N4G435A_rPXZIsz9V7yLYst9ZMr_tEmxAQ-2PSBCebcBLD3vfh-bRGVyG1TLZTuyLs_0xuCjuWyOMLJhYsgg2TOSgO1S0zDyYMtAUqeyi5YBKbJhCRQ
902b05b2a68fb3645575e5b05209f9d9,Academy Training Manager,Metropolitan Family Services,"b'Provide research support for violence reduction strategies, curriculum development, public safety plans, violence intervention, violence prevention, prison re-entry, criminal and juvenile justice'",https://www.ziprecruiter.com/candidate/search?search=prison&location=illinois,prison,illinois,https://www.ziprecruiter.com/k/l/AAJwoAYJ-cJ8sBnso1xaolURwOCUcPlV2bNxdcjtVZdOUjpqrZMSeqoleNxFAUMQRoEqZK1KC_XNlJeJZ9k5_VdBfWGOEb2nq7Lw-ckfBCotFEDMIqH7tp4mlwOiddjn1H6DZS6vw0PxKs75RB3eJ3LE3DBsy4YfMEnPSYIfKDSYGVG1V6i_Krm1zUJzuhg
398a9b9f5f94c79b5dc37e181e20832c,Program Administrator Senior,Northwestern University,b'The Northwestern Prison Education Program (NPEP) is an initiative of Northwestern University to provide a high-quality liberal arts education to incarcerated students in Illinois in partnership with...',https://www.ziprecruiter.com/candidate/search?search=prison&location=illinois,prison,illinois,https://www.ziprecruiter.com/k/l/AALYtrRISuaZVv3O4mKDbjktK4aeVMXzEdMPNPf3v1fKzx1Rt7wmjwNGUkKnhi7jY_1FibKCKmRfwqqoXZwrqdvC4C_mw0qSHnbuZhfRR_62vVA6qe2SqH0hg_TmLg_SHujvFodJ-WsVd2XubZDkJikC74nrtC4yAr1CVekAWGRQ12OTWxKvpaBTHCGRNL8
979cf27b22f99ded7e0624f9f681fe50,Hospice at Home Registered Nurse (RN),Pinnacle Rehab Staffing,"b'...Prison, Medical Surgica'",https://www.ziprecruiter.com/candidate/search?search=prison&location=illinois,prison,illinois,https://www.ziprecruiter.com/k/l/AALiiy_3jLhm7029QFCVldTjlmfNzxF8CfPGc6tCOIJS3mqO5UMS5tlOTISZfjdlTOREAOVe_KJH_bAqIEkMjEzYAApiBpvMp62-9wywy2efhstOE6Vtibe9SCyZI-GkiQxDKUeGCSDoVjEyK-Oqwdn_NHLPUazgfEhM5mB0eVPLwBMENFnbELWzw9rrUwM
dd89e83787927acbb28f32d33271ad22,Case Manager,Treatment Alternatives for Safe Communities,"b'TASC, Inc. (Treatment Alternatives for Safe Communities) is a statewide, nonprofit agency that advocates for people in courts, jails, prisons, and child welfare systems who need treatment for alcohol...'",https://www.ziprecruiter.com/candidate/search?search=prison&location=illinois,prison,illinois,https://www.ziprecruiter.com/k/l/AAJtbEIqN--CW9FfAAjF5sjZ5EMkUVPKYjo5Os1tIr9AwqPt-1tpwlLzbgep6VVhMRawNkD_-n7xn1nK5BoSh1PM3wkoBKAwdJmKqG-5B7mRUGGdx3G3nPZWa0qfamcygVZX260VAgDjleUYJSNAWUofkH_ZDFoq0d4M24LjXLwftKBIrP7ZVhCiePrbT-A
bf670c1da1d78b4591806a4844706bb0,Software Engineer -Video AI Platform,Motorola,"b'...prisons, factories, casinos, airports, financial institutions, government facilities, and retailers. Our products leverage cutting edge voice technology, language models, natural language...'",https://www.ziprecruiter.com/candidate/search?search=prison&location=illinois,prison,illinois,https://www.ziprecruiter.com/k/l/AALDjcVDezL-sVA1n9xdiUu-JNIImb-7mdd1N7U6XeJHGNf4FMcRILgk0RonRgwbHNGeWzN4pDNnaVeS9JiaX-kVIVKUOVjlIjQ0Q_Ceo12IbSzXHw1fUI6HAKvIdm8wmohnwZwj5DncWiKFX6gQ1OOTPF7uJsEd0f7wVDstgY3oMhuc6K1ENCW6CbGDwj8
b6f605f0758eb35412bdb9e7b699a8ec,Reentry Case Manager/Pathway Forward/Chicago,The Salvation Army - Metro Division,b'Non-Exempt STATUS TYPE: Full-Time OUTCOMES Carries an assigned caseload of residents currently in the custody of the Federal Bureau of Prisons (B.O.P.) or the United States Probation and Pretrial...',https://www.ziprecruiter.com/candidate/search?search=prison&location=illinois,prison,illinois,https://www.ziprecruiter.com/k/l/AAK3q1qC4ty7Cig2ygnSBrfY1LDken3KICaq99ljs9Uehp9qcee2x_Gm8fWGgoMu2RfORstkRpxh4AEBOPq3VDd-GrNFn1fslY_t65A6ajwpqLNzRKSL8cq9Qdw6mKIeyh-bWM5UaaMfzu_7wxxWvGg1wQqO5FoTmOFkoyZm-wokNj8Wydqkfh34LAt6vx8
e40e9eaae1487427c775c3d487de1000,Phlebotomist Technician at FCI Greenville,Global Healthcare Group,"b'The Federal Prison Camp (FPC) is an adjacent satellite prison housing minimum security female offenders. Inmate Population: 1,432 inmates. Work Schedule: 30 hours per week, Working 5 days per week, 6...'",https://www.ziprecruiter.com/candidate/search?search=prison&location=illinois,prison,illinois,https://www.ziprecruiter.com/k/l/AAJ-0JRcpe-zqaVDJ2lrdeyXHD_iSldLv6WbYrIf4Te5w8GhZ-TfzNEaIjxCo3_FVjHn9jmR0ythMI934yZHEhlf0y2EKF2EYKR6WfbJC4NAmbXe5s44Lc6VUEICV5stdqRVFtFTQu520bH8tjChIH4_r-xrOjuvJpGxX7-k_efS12Vd3F9k2-oMPwnzWrE
4d24c3045c4c58b102cf301dca5dfe46,HR Recruiter,Treatment Alternatives for Safe Communities,"b'TASC, Inc. (Treatment Alternatives for Safe Communities) is a statewide, nonprofit agency that advocates for people in courts, jails, prisons, and child welfare systems who need treatment for alcohol...'",https://www.ziprecruiter.com/candidate/search?search=prison&location=illinois,prison,illinois,https://www.ziprecruiter.com/k/l/AAIRyQymlC0iLDtEq5uyZ4a_osdaqbrO1Jk71MK8N_r5KY4QJfy_Ip6oC81FO_9Ph2_7WbtUxOIxe5C2qv88A6n_cACVbfMJiaQ4bBUMjJ9oITuQit1c_XYH5VqlEC-ciZSR4Fl9kilVu414ObCmRaeKOpZHFORvuJa4JfrmaTAqCzWsfBBZRf8FsXhGQOY
f7da3eae9bbbb9068f96ed1b1ae625bd,Licensed Pharmacy Technician,Seaborn Health Care Inc.,"b'Services will be performed in the Health Services Department at USP Marion, located at 4500 Prison Road, Marion, IL 62959. Responsibilities: * Prepare medication and other healthcare products for...'",https://www.ziprecruiter.com/candidate/search?search=prison&location=illinois,prison,illinois,https://www.ziprecruiter.com/k/l/AALA_R402VQt4upRki3LZB3694bh6nd7ppBeUtDAQvfdoyMNSNBIV5Kgng4DKN_Hi-kuQMgTWYpDYXiHUPLPaPLs_5WObSlgeqWll0Lsr6sTxxa8gZWI28fdCxHP9GcZrkAkhxotGff_J_memOeGpG9e0n0MkHiCLzwjPaAobbW37zpfHDGVAWhJoqP0kpw
ddbdb72099369c28222ac223a4f77829,Clinical Therapist/Pathway Forward/Chicago,The Salvation Army USA Central Territory,"b'The Salvation Army assists incarcerated men and women transitioning from prison to the community with the Pathway Forward program. Clients undergo counseling, access training programs and learn to...'",https://www.ziprecruiter.com/candidate/search?search=prison&location=illinois,prison,illinois,https://www.ziprecruiter.com/k/l/AAItcSxA3K5teFR7SQXHDyNwd9lgKlJO_XFHYu_dmSu2kdLAMzg01XlwQcBLUrc7u350oCRMiEOlCZTnOLDkKVoAEIbNjuw2w60IGIRjqaOzeXQ4hhtaAglvDgBFkMB6xx6YCF0VHVNCKlR4gi49Sui2pM_lANbnJi-XvrJwD18HejpE5hptfnfMnyyQw2Q
e1697ed41da3416b9d01846a44e0486e,Mental Health Professional,Wellpath,"b'...Parole Board or other appropriate agencies in accordance with the policy and procedures of The Company. Reports are to be completed in a timely, professional manner. Personality, intellectual and...'",https://www.ziprecruiter.com/candidate/search?search=parole&location=illinois,parole,illinois,https://www.ziprecruiter.com/k/l/AAIjs6YHlX-PCmh06vrljnmdJN7x0MyRjQmjiV6-Ab8alf0eBtOuJtOOCoVnIzhWegR7oko4XTgcys155Zl_kCYrkmmpwpySa65kLs4X7kNMyabDqkSDhZajhu_khZOxteGsXon4_NFZNO5YxV4QxeGMUic7GOk9LryFc_j_6fsQcObFkASbd2JdS2UmeRI
98f0c03acac0ba5e9a53ca23da981e3b,Correctional Treatment Specialist (Case Manager),"Justice, Bureau of Prisons/Federal Prison System","b""S. Parole commission, release planning, and interpersonal communications, individual counseling sessions varying in methods and intensity relevant to the individual's problems. They may focus on...""",https://www.ziprecruiter.com/candidate/search?search=parole&location=illinois,parole,illinois,https://www.ziprecruiter.com/k/l/AAI_nHrOrIqtfx4n-riR_xnvTUT7x3y0cLO59ZCIbz7iMxPQD8IjGl6hN3X-yfMmPeAz_2miO88PQUjtuBt6TiTYOkrS0FRUYs_7eUmwIasTTv2F3zy1QNOmRI5pEAKNEPV3Fxq3tYTWegEv0lnzybsG4rTBQ3F14rsogLHDz-GULlOzdoGq2zn7xjGR-Mk
d1c8abcb121a81599a763da3336318e5,Correctional Counselor II,State of Illinois,"b'Description of Duties/Essential Functions Under general supervision of the Correctional Casework Supervisor, provides individual and group counseling and guidance to offenders in preparing parole...'",https://www.ziprecruiter.com/candidate/search?search=parole&location=illinois,parole,illinois,https://www.ziprecruiter.com/k/l/AAI5PKJjT6IM1SyEdh30zxkfp5O6NuvIrJjqr1LZ6ReNcGd1HACUd64h6HWtckxMDnGoM7QMqGM8BupGF4Z-HGWq0976ClSAl7ezY3GEXfBimL0nifcTddoP0rv88F9wuZrkOIkVFSM19ncnEs7h1hcHfLXOXebDU-O5uUWaEaUlMGfTWXWcqTMYX-UMU2s
3231e61af945b91087fd38945cc1967b,Roofers Experienced Residential,Bradley Construction Co.,"b""Must have valid driver's license and not on parole or probation. Excellent wages and possible benefits after 6mos.""",https://www.ziprecruiter.com/candidate/search?search=parole&location=illinois,parole,illinois,https://www.ziprecruiter.com/k/l/AAJgG7Hehk6Xhz4hK_egeX3tHlwA9lh_nNW0yHvWQy0oYaIxZIdIwRkW-yyuhIUG7QX2bJkSBcMvwBkB6byak8whhyVGg6wZ1t2FzGVQSAWul4OVTIFUyI1TcBUBkSkkD86qx0NAUqEj31vrqyMQ5Co80wvzG3L1q249RJSF7vSUjsTHyp55ZdiFhhRKmA0
c1ae40d6e3fc84fb7cb1ccb3ce2a3974,"CASE MANAGER (MAT PROGRAM) - PEKIN, IL",Gateway Foundation Inc,"b""Communicates with treatment team, supervisor, probation and parole officers, and agency representatives in order to plan and coordinate services, and relay information on clients' progress""",https://www.ziprecruiter.com/candidate/search?search=parole&location=illinois,parole,illinois,https://www.ziprecruiter.com/k/l/AALpfHTNSUjbkPEnXXSfC_bQ6dupb16mzL4J8kjwP0Tz2yE6A4hXSqWjiVnbIL7zJ9Et_e_OpAJmW50cYmlT8XzptJ8_-p1zBpT1X5M8X-HnoKwj2jYU5DIwllVviSWjvmXKUQFU_Lfld8sfSSv23mfXEhnc8W0WQalW6ZriEaunbgSnCjT1O2zsXf6Rxu8
cef8c81236ef92f8df9dd0098b11c434,"CASE MANAGER (MAT PROGRAM) - SPRINGFIELD, IL",Gateway Foundation,"b""Communicates with treatment team, supervisor, probation and parole officers, and agency representatives in order to plan and coordinate services, and relay information on clients' progress""",https://www.ziprecruiter.com/candidate/search?search=parole&location=illinois,parole,illinois,https://www.ziprecruiter.com/k/l/AALJ7R8PrI90yo8n1efrnZKVFgSJCKnvtKgQ7h5yhEoM9Cn7FNqjWKZ5Di_Kc-Z8TiK-zo4N1sZzPnz5YmbebsmrUx9RhQh3U0c4rJKsxbOEhl42qHkdv0V8-y9vyq4Mc8no21EBoMI_VHLcM9W1uPd4_bVwa7EVMeBJnGjB_60iY1zkUlbOsKn3rNROrjw
cbb261722fe0c2cfca53bb195c7d1b88,Correctional Counselor I - Opt SS (Upward Mobility Target Title),State of Illinois,b'Requires ability to prepare evaluations and to develop recommendations for placement within correctional programs and for parole placement and supervision. Conditions of Employment: Requires the...',https://www.ziprecruiter.com/candidate/search?search=parole&location=illinois,parole,illinois,https://www.ziprecruiter.com/k/l/AAKPASa7TL47iMCShLu6bZsUBh6E0vYWMSkzOWfDa50NC15ZEZh_f8qgIm0nHDUXVBVpPPOgopjNqW7T--QhVckNazy6e7PVODfOMgHm4z8sM4JfMUKcoicxC1KNPBV9OxZRmq_f_jrlu6iQwA88bvwO4ZFvh2LDLsAJ3DzCbthLBYgXSCAnAPJ4IqgBQxk
eec0d219c3c439b6818aa8848fa5449f,Correctional Counselor I (Upward Mobility Target Title),State of Illinois,b'Requires ability to prepare evaluations and to develop recommendations for placement within correctional programs and for parole placement and supervision. Requires ability to develop adaptation of...',https://www.ziprecruiter.com/candidate/search?search=parole&location=illinois,parole,illinois,https://www.ziprecruiter.com/k/l/AAKsDFO40LGBXrCDHnci45xEkr5coakqoE5u-t9jjP4Ur45gB_FrC6P3oYlcGGSbjU0SaEJi0kUH7gwCQXuRt17Cc9Z_fBjYwYK4LK-VkD6jVNm3w65smceBDwsE6xvFVEeG1On57aCqj9ahdKoAr48KrlISjaFP1oNVh7vSyh1t5dmKgFikGRVZxE7z7xg
633bad2ae199cfddcc12d217be5558fb,"ADMISSIONS COUNSELOR I (CADC) - NAPERVILLE, IL.",Gateway Foundation,b'...parole in order to facilitate assessment process and complete necessary treatment follow-up and case management. * Performing initial case management in order to facilitate program admission and...',https://www.ziprecruiter.com/candidate/search?search=parole&location=illinois,parole,illinois,https://www.ziprecruiter.com/k/l/AAIbdpxFlq5dGF0wg3zJ1wxtZyjkc3q99NaUZcAH1mbLvsRTIOcfRobfxQwRYg3rp_y2rgFHTH02YCV2Ar-YzagWSUNirexPfyg9yccJt48-lfDA3R0hYVI-YosyVGY3H-6F1nhIFGHE0YCCQACI8ZPoai_mFwyj0wm8CI00tqeYWKDi-dEZmAfcyu_hUIc
20a9b3c74e608af67848dee2d4708636,Clinician / Full-Time / Days,Chestnut Health Systems,"b'...parole, court, medical care and natural supports. Promote positive interactions within Chestnut and with the community, especially with referral sources and natural support systems, to sustain a...'",https://www.ziprecruiter.com/candidate/search?search=parole&location=illinois,parole,illinois,https://www.ziprecruiter.com/ek/l/AAKN-QfJGvX1UrVgsR1tyJm6QEyiiRmSG2hCY2LJCHl5FvPBLMlf3vh9UWQGULQ-OnHl6_Y-gc4Rroa0KGroe95Wd79TgWpzRxQ1u0fNOHGnAOfofQGIqtRT4hGMzJ1n_X_oBtEl5jhGQNTu_cVJ7QVMBZE6A3VADst7vrPT7E6dq7LsYd3U8DG0O7QyLozP
a286d649a0bd39975b4881299616d66a,Registered Nurse,Wellpath,"b'...parole, and patient teaching. * Assists the DON in ensuring that appropriate levels of stock for pharmacy, medical supplies and laboratory supplies are maintained. Provides for preventive maintenance...'",https://www.ziprecruiter.com/candidate/search?search=parole&location=illinois,parole,illinois,https://www.ziprecruiter.com/ek/l/AAIyX_a7VEEJycO88hoiENU0xGzfnwD4l9pTuqgu7KbBRPVQJcx69Sn5nlxfWajqOjLB1ejbQHaHD7R0Y2rXPIkCdu6qsp0eWc8MEDA8o5YjSOGXumP4_nNYxvpIXgDrNgRwJNKTKdd-Aad3SAjX0YMU86UVQOfM5Tot4jtkUGad4Qx3T2IBUvPpiJz3xOwl
c2ffe84b1fd4142776e20fb9b7b07f4b,U.S. Probation Officer,U.S. Courts,"b'Parole Commission, or military authorities. Learn more about this agency Responsibilities REPRESENTATIVE DUTIES: * Conduct investigations and prepare reports for the court with recommendations'",https://www.ziprecruiter.com/candidate/search?search=parole&location=illinois,parole,illinois,https://www.ziprecruiter.com/k/l/AAIAuHt1qAp3lwBrWRQMyccjVAVcJCNPk1MLh27nFUPFiJ-p-gy1X8n--DvW0R-swZrNN6Nf0CLX8PT_u8d2CyXEx1PvkMRelS-xolpINyp0ReN_zJ7cTRJvP0_PIQtB9xwJX1O3aU1s3tb9_rIfPxpZ1w0I_irwQvFnYo1-sXTFj5JkVYEb4MCRcsqTY3no
