job_id,job_title,job_organization_name,job_snippet_text,source_url,job_search_term,location_search_term,full_url
a9a583f64d9a43450613ba46b29590f3,Class A CDL Driver,RIRI EXPRESS,b'...CLEAN RECORD -LOOKING FOR SERIOUS CLASS A DRIVERS - GREAT HOME TIME',"https://www.ziprecruiter.com/candidate/search?search=""clean record""&location=illinois","""clean record""",illinois,https://www.ziprecruiter.com/k/l/AAKT4OxKcwEq5eTfXNsCKuNNFoyUAO2BbdlOFVDIc5HxyDtABOR7Zdu11ebJtie6Odc5iOgKNtGcfNpvZLGZdP8M20SEPSTY4kdCUPFIPCt8ab8k-MQW_oppZIsRKHdWW1XX1Q-b7OvQblR-hGLlHChWyw4g0boOjeRhCdYAmgO3RUuTRvgVctVdYwmGdik
c7ec0ac810c828effee9219c9222c1b6,Great $$$! Home weekly!,Brite Logistics,b'...Clean record',"https://www.ziprecruiter.com/candidate/search?search=""clean record""&location=illinois","""clean record""",illinois,https://www.ziprecruiter.com/ek/l/AAIa22P0rfBVmHtRnFJXh4tOJLgdlrS8cW7Wxl8CSRDztsjrFW69MjHlczcBkATsZwMOpl25ZU8BzyMGFcXUoqQPR1ldFE4vY2QH-Te6EGQZ00AHztd4CopkzzPEcCLAydunBJdmyCKcVfz9jRZftBGQmM2MX74WzsSprjknl6hBcNtOqMrCPrTm3QN-XGQ
0fb3adb484201b4f2d5722bc94ed89a3,CDL Class A Driver,Birsan Express inc,b'Illinois based trucking company is looking to hire A CDL driver with a minimum 2 years of experience and a clean record. We ask for professionalism and responsibility and offer instead a friendly...',"https://www.ziprecruiter.com/candidate/search?search=""clean record""&location=illinois","""clean record""",illinois,https://www.ziprecruiter.com/k/l/AAJM4tQhh3ys-usjB8iQuwar9FSudbk7SgX5jiSNpEYhao0UAiangw1zIYOeI2Bm7-NEHyVURAeeExDIDXI4eD8OcEqfIAkfmM5HAuefe_-OFnxjLVcct4byHHF3u3WBHlOvKB6hIVIFM0LQQodZaHNx5RsA5yGE5ly4VGutkg0wYK9aRKxN0i-Stbp_bAI
edb1286ed6786103f1b33cfc9574c193,Truck Driver - Consistent Home Time - Competitive Pay - Great Benefits,C.R. England - Company Drivers,"b'R. England is seeking drivers with a safe and clean record that can handle 18 wheels, 40 tons, and 400 horsepower. If that sounds anything like you--Apply Now. As a National Driver with C.R England...'","https://www.ziprecruiter.com/candidate/search?search=""clean record""&location=illinois","""clean record""",illinois,https://www.ziprecruiter.com/k/l/AAKReOAXa-x4f3CI2vsUzDzBpDMTtkPRQJN7WBRtQkPlGtDjzViHCuHKX07gjgdrCvif5-ir4Efq4HMMbuQsa7w1uZipll6TxU-2LQnSoz3Z__MR9pXJM-3P6Yi1g8XkUL7V3xXaSRKEmTt5Z_QZTzlIos7zygy7hTBj348moLjksBivzTAky5XR14-kUGw
c19b04d8bcf180da9d35d57409b286d6,Parts Counter Sales,Aston Martin of Chicago,"b""Must posses a driver's license with a clean record and pass a background check. What We Offer: * Family Owned and Operated * Growth Opportunities * Medical, Dental, and Vision Insurance * Accrued...""","https://www.ziprecruiter.com/candidate/search?search=""clean record""&location=illinois","""clean record""",illinois,https://www.ziprecruiter.com/k/l/AAJF767EOaV1cVd3EhBkWsi_k1kDNfat9VAOQ5Rb2sUqlBriibUUGOywOE4PNK1dB6s4lPxV2Jc1DlUkb5Edcv619X7P-8KhJd3dAbk9ZaTx68_Yu3i2RDed1dVlcRol0yTTjjs7ivHxWoUDH3yDSp5WAC86UkZi1Q0soU39L7YkmhC7hmyxy3_wKXgOoKE
9c46356fadd56343cd7b92c90319839d,Attic Insulation Installation Technician,AAA Northgate Heating & Air,"b""Current driver's license with a clean record (Class C not required, but is a plus) * Can pass drug screening and background check * Physically able to lift 50 pounds overhead and work in confined...""","https://www.ziprecruiter.com/candidate/search?search=""clean record""&location=illinois","""clean record""",illinois,https://www.ziprecruiter.com/k/l/AAL9XQT0vhudnjnWWZ6sRbCO5XBE5pOeevRaAiRQIBGGlOjFomJMQEpaA7kNAdZjhl6OEy_Na8oFt4YXTnnRC96nWdav_uikQir-vrvQjwzUkh6wohGjYELkbDcgELL-rMshIHBJzsH_LcEhSlmz_75taiN_7B0h9dbvIV1rrZS8yMcOnSgyUWgGPf5rh98
f9c850c8241e8beccef128acb5e100ed,Mitigation Technician,Paul Davis Restoration of Will and SW Cook County,"b""Valid driver's license with a clean record * Have the ability to work nights/weekends and overtime, if needed * Ability to lift 75 LBS frequently * Desire to continually learn new things Role on the...""","https://www.ziprecruiter.com/candidate/search?search=""clean record""&location=illinois","""clean record""",illinois,https://www.ziprecruiter.com/k/l/AAIwcyFRRd4_-F01f3CarrrSV8NCNM52XQ1KAevFIKfLtn4bl2YSEERQZswBCj5SsT_MydLO80yZXG-Soaz2B3Hrt_xmQtbYCOEB7KrCkaLg6vzpPAo1nc_knzLipHPEbH_RCxhj3pRhIkaXKQKtGghZKVkKauoTPLPo7okCDjek3PnVD9_I8vCWWbs1fYE
4f28fb02ff84cdb87494a44248384bec,Sales Guru,Surface Experts,b'...clean record) References made available upon request Must pass a background test including drug test',"https://www.ziprecruiter.com/candidate/search?search=""clean record""&location=illinois","""clean record""",illinois,https://www.ziprecruiter.com/k/l/AAI8Ht1BiGAeZ7eDIOXLoAgwv0jIX3uxq1IC-S6M-aWCuw62QqStwppL8DcKzQu_b-ZfnvS4Vx8S6nETOZgfaL4966xXo4Nm2QQ5i52el7yQlbO8DiX054LQm2ue-OqOYTet17eBV525oZyRrlPRlErO3ENHt2Ggc-nUWk-kSbMy4qzeo25kqwj3zgREKgI
7cbd10d32e9a89ea69392b26c3c5b47a,Armed Security Patrol,Global Security Group Corp.,"b'Valid DL with clean record for the past 10 years * Must be able too write clear and accurate reports * Must pass Global Security Group Firearms Training Program Job Types: Full-time, Part-time...'","https://www.ziprecruiter.com/candidate/search?search=""clean record""&location=illinois","""clean record""",illinois,https://www.ziprecruiter.com/k/l/AAKGtniFEC5Kg7zeFrzTPIGE_UbfF840oY3-0Pc888Nz3QPk2M5tEPlDmr3Gnonr0UzD0kDWj2SUrO0jf3zsWHl_Rwp5abj56vksjkId5jtUipY_oCL4pEK3pcSVlX7uvt5Stlaal0xjO48tMOJa-4Vc2sYZZEs63OWylWV3QaFkCdarY7gCx0ArjO9nBvk
5150e902096fa07c9ea69be1b91d4748,Driver,Kuusakoski US,"b""Class C Valid Driver's Licenses with clean record. * High School Diploma or GED required. * Basic computer knowledge, efficient in MS Work and Excel. * Neat, professional appearance. * Exceptional...""","https://www.ziprecruiter.com/candidate/search?search=""clean record""&location=illinois","""clean record""",illinois,https://www.ziprecruiter.com/k/l/AAIkt9RpUoN06GP6wge6qt2kRx31lx73cbmoqUdtAkJ2sJPa0TE53KVvC039_EfoUJ1Ld41mGq5HZdSZYwj-hZ7safs5NVaDBUQPzK9twLmAStJga9cZugpiVsufu8eDvh0XhQw0SetNLvp6OjOBS2VB3uQf99eSk99-iNm24DM4f3ISsH4daVdOKM1nYQPk
383d184842b8ea5ea857da7fa39bef3c,"Drivers Class A CDL - Refrigerated, Safest in Trucking!",C.R. England,"b'England is seeking drivers with a safe and clean record that can handle 18 wheels, 40 tons, and 400 horsepower. If that sounds anything like you--Apply Now. You Get ALL the Benefits  Weekly Pay...'","https://www.ziprecruiter.com/candidate/search?search=""clean record""&location=illinois","""clean record""",illinois,https://www.ziprecruiter.com/ek/l/AALtmGgWm_ETxoNQRFelaS144cbCGJTwLsSMRkDKjrbzN5ty5W9AKhhF9jjZK8d3FW41OlvkHv7wPDVyu6T9iwVBIdJzJZe4Kx55B0pblUL3kr1dsM_z5I78681BrzTCmVU-h0sEhkU9stBXOk7HHZ4O1c0DOQ_oIIMsY3ThM1eclg-YYJH5nJSH0MgEbB1j
bc3f293a7d0ed02825cd6e03a7a86f32,Trailer / SRI Reapir Specialist,U-Haul,"b'...clean record + Forklift certified (can be sponsored by U-Haul) Work Environment:The work involves moderate risks or discomforts which require special safety precautions, e.g. working around moving...'","https://www.ziprecruiter.com/candidate/search?search=""clean record""&location=illinois","""clean record""",illinois,https://www.ziprecruiter.com/k/l/AAITQr-8qsN9V0xZTZlt23PkCRHibNi1cLbenBWYIedljS7UMpFpNZyN26BQ4ukyan6h4V3MWSTVKiDS6xL52S-Sea5xjsqwPeRwA0zdVJVCAJjwKfRmZMOR1rv9wkP9USC0qG60cFsfFtqisH10j59kG4h86VQt8Tn_NZsVcbVmchc4FNnVtwosxqaabYqW
999b3e754072db104b28e22e29a9292c,Parts Foreman,U-Haul,b'...clean record + Excellent organizational skills + Computer-savvy + Forklift certified + Excellent communication skills Work Environment:The work involves moderate risks or discomforts which require...',"https://www.ziprecruiter.com/candidate/search?search=""clean record""&location=illinois","""clean record""",illinois,https://www.ziprecruiter.com/k/l/AALzbAEqXNYoPqz4WT64PkLHjWmWpO2oqNASieLUGZcVy71kYQagb_n7a11ffNRf6JdnD4WpOTVTQEX15mRqNs0pDytpAPc3vKuYcdJqokQwOtlZ-TRjIi1blry796M1kLzc-tJrnvw6raoG8-Y86qmTIioecnasV95jGvXda419rcEEoxjKf6b1Yq5wJ9n1
8f54f1cec32e8b66289e0675c2cbc320,Class A Driver,Conversyn Transportation Solutions,"b'We are seeking truck drivers that have a safe and clean record * Must live within 30 miles of McCook, IL * NO MANUAL RESTRICTIONS! RESPONSIBILITIES & JOB DETAILS * Deliver for dedicated account'","https://www.ziprecruiter.com/candidate/search?search=""clean record""&location=illinois","""clean record""",illinois,https://www.ziprecruiter.com/k/l/AAIxeQP82Syu5qDn_vAoOtWaScFWZJLZfHhsnBY-olcCeA7_1seGTlqj-mX-k5IWGC7PFSM5ELTfxq43qVpySvE2w8hlgO1wpQ54-d3r4xzC4-nKFNJS8522gc9nmdhljJKngKA6sVrw0GK5zvH2I_P0CcLM6atL62V4RsRKYJQ9NfWpYJ46oQDvdnDnmb9J
b25d05a5a7073ed213273536318a9201,CDL A-Class Driver,Go Neal Logistics Incorporated,"b'...clean record and good inspections Now Available: - 2016/2017/2019/2020/2021 Freightliner Cascadia, Kw T680, Volvo, Peterbilt - 2019/2020/2021 Trailers -Lease to purchase -Company drivers -Owner...'","https://www.ziprecruiter.com/candidate/search?search=""clean record""&location=illinois","""clean record""",illinois,https://www.ziprecruiter.com/k/l/AAIDkA0iN9Kby5zEZj2HhKboFPmrSIYfipE1T6HJyLoqH_G0nnvWxzkXdO2SAuK9hZzOhCaUUeGwL_ZybLRL32x3wPLT7-2bT-atXgTG0QRHDPiYqmoeT67Y2vq9DHe4D16f6YpRElzGxCtEP187y4DhhIy9hmtxaOmIEyJAFfDKLI_OnWT2U5hMPoPivjk1
24464378f8d87e05adc16cc007ff2dd7,Customer Service Supervisor Medical Equipment,Rotech Healthcare Inc.,"b""Valid driver's license with a clean record in the state in which you reside (where applicable) * Employment is contingent upon a drug screening test and background investigation Skills * Effective...""","https://www.ziprecruiter.com/candidate/search?search=""clean record""&location=illinois","""clean record""",illinois,https://www.ziprecruiter.com/k/l/AALuiBFtXC1y2mBZAJjYWFXOQowe3sfAvLrE3bd0e2UgUZsqnly3mC0HH_YC4_ejHUcczeaQb5Vo7xC9wcW67iQKrACB4ZnjrRAzii1q1XIXblOBfRRbiYCObSX6izsd9HEsQTlUwovkjogXELRnPLEj_pSXt2rcaMvIsltK4Opcn-FKLXcd9TMUnpVi-m_W
d8e5890a019595dbcf21ef21842130e3,Refrigeration Repair Technician,Mr. Appliance of Barrington,"b""Valid Driver's License with clean record * Must be at least 18 years of age * Proficiency to navigate tablet based technology * The ability to safely lift up to 50 pounds on a repetitive basis, and...""","https://www.ziprecruiter.com/candidate/search?search=""clean record""&location=illinois","""clean record""",illinois,https://www.ziprecruiter.com/k/l/AAJTfawoSrOn4h4iqiqNUelst0HlKqakOl-wguH3VhdrC4RlndncIGOXV1Kq6wbS-Y4ObEN_0FbchiDcewDHhZl7B59aqpu6EWPCDZUo5_GZXXAhF05eP_zB6EMHfCPdE5bQht0HP_o9ZhOW9nwv4CzHwN2oKGNf7dq0pvv3wZopUT6zDO7CHaeXzJw_j0IX
d3a77f0cafe6dfe7b553be82babc67f4,Class A Local Route Driver,Christ Panos Foods,"b'Must have Class ""A"" license with a clean record'","https://www.ziprecruiter.com/candidate/search?search=""clean record""&location=illinois","""clean record""",illinois,https://www.ziprecruiter.com/k/l/AAKiQ6iXtmUzjVxDmztqcqXiBLFEJ8BipjDVloUBLhHAo1t7U36GejTdWQQjs1Nw93GVIqQqBRgQiCEYWPYc9fFdGdSBl43OW5cU4O8gFjmqwlPXzw77DuUBwVG20H_lrJcloIkWiWdVt_RRcl2LUsGIBAWkej7K6Fj1f2Qap3HQSNPgGW8KlxpVVMhoRSEQ
a5c93a34996af970d0f34918aeb9a219,"Neurologist Needed In Marion, Illinois!",HCA,b'Clean record and excellent references Benefits May Include: * Competitive salary or income guarantee * Relocation Expenses * Comprehensive benefit package if employed * Potential commencement bonus',"https://www.ziprecruiter.com/candidate/search?search=""clean record""&location=illinois","""clean record""",illinois,https://www.ziprecruiter.com/k/l/AAIj7WG6zK9T9uKoPYHOnyzI5GORB83XeFeypRt_xaAO5NPggdYn6VYyhLu0bw4ZJsHXd1nvqQZa5BbH8YPa7PGtXTbVZEkkGfxCHuigs7igfYS5u5i5fBJDWWizvw_kjj4OYYG-UG358JtHEusoRw68TK2dri-mcZn4pmpYVrXRzN29snOWlz97HuBQ4z_D
57a336dbbd7b0ba5ec32767a0b5790db,Truck Driver - CDL A or B,Avalon Petroleum Company,"b'Clean record * Tanker and Hazmat endorsement Union company - Teamsters Local 301 Excellent Wage and Benefits. * Medical, Dental, Pension Plan * Dues paid by Avalon * Compensation based on experience...'","https://www.ziprecruiter.com/candidate/search?search=""clean record""&location=illinois","""clean record""",illinois,https://www.ziprecruiter.com/k/l/AAI-dV_B1PkQOhlFYi5FAfpVsscHQteKDFJrjz2YKQHNPKMRKna3JXE6HWRjieqXIEeh9dgt0MTOeE0OKMDQQsuS0touq8vYArUXA19AFXz6jCyFj81xK88IvuvacwRKbqJaUuWWNFYVMJk9BA3upGXlU9AThg5uiUBkv8V18iykqPOnG-CZGzWAneGG7To5
dd3f495ab7540e11cca50ab781c04f81,Owner Operators You Can Now Book Your Own Loads!,A2C LOGISTICS CO,b'...Clean record - no major moving violations in the last 3 years',"https://www.ziprecruiter.com/candidate/search?search=""clean record""&location=illinois","""clean record""",illinois,https://www.ziprecruiter.com/ek/l/AALlJ92Jga3QmVU850_NuXCaN1W1xVCVEER3c9qZA9fYAzC6jMnmeuMvXIkhFSqivRMxjhwPOzq6BpbU5fKTGBMfM4NnjEC-CFnyuDK1k8kPrOHa4BeEm8DU_MdQvl5Vvi_-pUsid5G4bc-jzYY9T0we2myeENZHI1DHcjTLGpjl6Fv1w3ZSgxw-gwwFgZ4
751a533e584a7e173f4bfde5948171e2,Service Tech (yard),WillScot,"b""Maintain a clean and organized work area. * Operate a company vehicle safely and maintains a valid driver's license and excellent driving record free from points Fleet & Efficient Use of Resources""","https://www.ziprecruiter.com/candidate/search?search=""clean record""&location=illinois","""clean record""",illinois,https://www.ziprecruiter.com/k/l/AAJCao56mR5R4NQsfIU8M8zE8g-nPzzP3xZhzfnRP9DTFUJDuqrpkVc6hoV--QQmcdip8bMR2KQGb9HW6GTKj4RMWzoU98Rc8HiFRTWtvh87r_HT5SWrnyvgsyNdIZ-7QB9-BXh0u3Hyf7yunbEGfGR2H7cLFhj1JlY8rACJ3brzJDn3Jw6I65oSgqlvMl4
6424ba2f7cc00cd2c9758dce97542ab8,Neurologist Needed in Illinois for Solo Practice - Great Referral Sources Equal High Compensation...,"Juno Group, Inc.",b'...Clean record and excellent references Benefits * Competitive salary or income guarantee * Relocation Expenses * Comprehensive benefit package if employed * Potential commencement bonus * Potential...',"https://www.ziprecruiter.com/candidate/search?search=""clean record""&location=illinois","""clean record""",illinois,https://www.ziprecruiter.com/ek/l/AAJnpQlrSa-M_-AG8L8WTHlcbK_-KnowRJEIfJeN7naKeqc-s1_mqAI__clNqWxk99AkNlGRJQY0rHDJRNF9hCh6uoqCRCujOmCNsnO6OF7vMUZVg8hgjKFyWCcR-aR8NH-BSiXwm-BIeFHmtHrJN6FckOTj2suKo2GvB6atY7cQG96jjFDZ-csqwDnsgew
1b2d71f1192a2aea823dd1d5ef4cd0b7,Traveling HVAC Technician,"Latitude, Inc.",b'...clean record + Journeyman level technician with several years experience + Strong problem solving and critical thinking skills',"https://www.ziprecruiter.com/candidate/search?search=""clean record""&location=illinois","""clean record""",illinois,https://www.ziprecruiter.com/k/l/AAKKTYPtWf5SzyQsWm6Ii26FGhT1Attn0xNtwHWxeInpk-3DqaASZfWX9RRrNnqkUN6hoDcMyMUlZQzpcOEm5goQm4DbWDZmxK5cyFU4-CtGaFth8F453D2L-2nBYORaD7Lb7q7nLJCI0tRzo9r6L9lhNF0cD7WD9vx7rUi6Bmd1SJk410s6_AC2T8KEprk
a75f77b06ad4405c97f87287d21fb706,Neurology position in IL,Archway Physician Recruitment,b'...Clean record and excellent references Competitive salary/income guarantee - Relocation Expenses - Comprehensive benefit package if employed - Potential commencement bonus - Potential for medical...',"https://www.ziprecruiter.com/candidate/search?search=""clean record""&location=illinois","""clean record""",illinois,https://www.ziprecruiter.com/ek/l/AAIwrFhIa-blcrujYBHST9X9R_zcJINilJUOfPsDMU4EDx6Rd5vSocoUzW9zXLrFIhgqi0jMv9UdUpSRQAPkmqm3vYWYyQO1hRm0S9T0t3FEDiMMz7XAGqAAdvFcxLnjZKmNzoElE-5UoimntsUDkVa0mU-PRdFZIJie7ggkr2KQ8mhKdfwWTNN-qW0N6FY
5030af45b7338fded620360cbd2a11f1,Field HVAC Technician,"Latitude, Inc.",b'Driver License with clean record * Journeyman level technician with several years experience * Strong problem solving and critical thinking skills Powered by JazzHR I8Zfmnow05',"https://www.ziprecruiter.com/candidate/search?search=""clean record""&location=illinois","""clean record""",illinois,https://www.ziprecruiter.com/k/l/AAI6Z7nCXueXAaZY1khcnkzK0Ton7wBTc11zQdaiFhG6BREuS6o1drnGMM8erfC2H4qD8HAHGfqNvniN-7KE2EWjPM7goci24iQOQcNSBiLeB5n95AJlPVuURxs8fDbEjM2lh9LnFokWEvG01lN7xJOsVRT-o8kvLOx17uOyY9vaMvbz09hoVah54EeQNjo
7d3486f585f9fd2717c0a8af0b4a3238,Team Member,The Grounds Guys,"b""Valid Driver's License with clean record * Willingness to work occasional (paid) overtime * Must be able to lift up to 50 pounds to waist level and perform all other physical requirements associated...""","https://www.ziprecruiter.com/candidate/search?search=""clean record""&location=illinois","""clean record""",illinois,https://www.ziprecruiter.com/k/l/AAK8z9kUNyjmCYgZMrRhPp3B2MGt14MRGajoTyFZaqLtJ85FK97jWKTXLzQRSAfDSz3uiKOqydUcGO4F6AmHDA_mwUNoOo-IgRQCCTMi5Ap2GGJXkEiALQpZkWFflWHCOF2StkbtXTqAW_fL1ViXB_RtBXPhmSqmYwDsRPhQjv8e32Xg-pOr_ShplpdKR3s
33a25ceaf9e0cf9d7b90eb0d4707c2a7,Certified Nursing Assistant (Sitter) (Email Corey),NurseFinders,"b'Clean record * Ability to pass a drug screen * Updated Resume * Be open to working 3-4 12hr shifts a week. * 2 Refrences LVN, RN, or manager who has supervised your work for over 6 months * To be...'","https://www.ziprecruiter.com/candidate/search?search=""clean record""&location=illinois","""clean record""",illinois,https://www.ziprecruiter.com/k/l/AAJxvYDtbHt_yrFy4kqOZqlyt_R1p_8AlAyT1rTGwUxfN0YPC6KkN5f5Hf-cRfGgKEyCTpzkg-V5aTF60iUHdYtiRNjKmfAty-sQJTvCwrdLSgmPXZyFZSpwYrKmOnt04NrI-7cFFVAi0_8jEyg2-3XhdL7MLxf-hq8bKsMaVxYxCTbGKg_KplxRQHbwG8o
d69e407d705e4a880c32691ac320c858,Neurologist,"Spot On Recruiting, Inc.",b'...practice -Clean record and excellent references Benefits May Include: * Competitive salary or income guarantee * Relocation Expenses * Comprehensive benefit package if employed * Potential...',"https://www.ziprecruiter.com/candidate/search?search=""clean record""&location=illinois","""clean record""",illinois,https://www.ziprecruiter.com/ek/l/AAKPS_xawcIc6yLX2-n1byHVx2ssnF1ovQefiuF3f97LHL6E-NiPl0umnTZfOX0zeXvVO_phe0G5HKfco0VYM8aLNRK62BXrsrNCDjoYWrqvnXQAZuGJ6L7V_rtIc4B8I5PJ3PhrOMV2Oje_RurVPNqHz06pUSEOmUSnylc2hzyUqUDVEywLSfMoaoDtM5g
823ece162817390128b8cff3588c4b33,"GSE Mechanic, ORD",Evergreen International Aviation,"b""Valid driver's license with clean record required. MUST PROVIDE OWN HAND TOOLS. Must be able to pass a pre-employment drug screen and a 10 year background check. If applying in person or called for...""","https://www.ziprecruiter.com/candidate/search?search=""clean record""&location=illinois","""clean record""",illinois,https://www.ziprecruiter.com/k/l/AALrXKUfw2YGckaCD3yJeH0wSLIJ4QAuZzMfQuhS3VHiprCmBAvkIDzdqFX-g54KbnvbCTbU4ACBGYNaigt-3j9U-JQ7qsmGdogcgDsNJoo_5OJmG3D1DhVKH9t86F6HkuSeN57cA02YBd8H416WrVZa44OKkDSC7COtDeTVFwFxMRkRj1VYC4HlBgcUw8qW
50373a95308156197b1c29d6bf828cc7,CDL-A Company Driver Home Daily Driving Jobs Available,JTL Carriers,b'Requirements * 2 years recent OTR experience with Class A CDL (1+ year reviewable with clean record) * No more than 3 tickets or accidents combined in the last 3 years * No drug or alcohol violations...',"https://www.ziprecruiter.com/candidate/search?search=""clean record""&location=illinois","""clean record""",illinois,https://www.ziprecruiter.com/ek/l/AAJ2gJi0F9t2hEO9vRLGhqhTeI0IFTEr3Fnu1NaGeTcc6XES5h1T3KSCDWMtVfup9RU68oAmcmFq3e6Yx0RzDE79okH59_ndHig69Y8fvqvLm2ZDL1IEHZWxF370RCe-rno3aQURhIfjZNt9VeddehELvn1p51DJigSBHrpgrfKLfRMa8z4n_mTn-iLS6lN0
b0be9fc2fd7c0c2c612d4b5c27ebcf60,Junk Removal Moving Local Driver,College Hunks Hauling Junk of Naperville,b'Must have a valid drivers license with a clean record * Must be able to lift 75lbs regularly for extended periods of time * Must be able to pass a criminal background check * Must have reliable...',"https://www.ziprecruiter.com/candidate/search?search=""clean record""&location=illinois","""clean record""",illinois,https://www.ziprecruiter.com/k/l/AAIHupBhnuRJFpjp3GEEfzv0KIi_gEl8F9l0F5dOR15gbOojG1_r9OLmvoFTJjjMNbxanfZHkiNIN5VckcXJBLfH_DOxDS6qyWQ3BTmbl_73p5K_gxqUxS-9kzwcEaHkDcr2VvrGtmkTqUOpa20PkSOpWYVqd8NzIKQG8RsyeWgCcsi1OZxzfZ5SvsEphCRx
c7c0f4bb50437c32625b72e574252292,OTR Class A Driver Position (Midwest),KGZ Transport Corp,b'...Clean Record Company Description Our team is friendly and trustworthy. We are looking for an experienced dispatcher ASAP. Contact us for more information.',"https://www.ziprecruiter.com/candidate/search?search=""clean record""&location=illinois","""clean record""",illinois,https://www.ziprecruiter.com/k/l/AAKqnbDqGRSgkSjPLpMNVfGA4m8C_H0_-womQdECamZ1XQfJKRP0CuPplYXKHjNjuTLZBlotRz560RCsiwDQx6jVMN7si7u6Tcqcs3GGz29ydBl3zCwUe6tS1OFzJAgLn8NcTaPQCMh5NdqjN39E0PiopZFJS7VxacCTIUN9JhWV62Bp3E6391nLEJGUfiNG
f88da32ea04d0e9e1c702175e6038070,Journeyman Service Plumber,Trojan Plumbing Company Inc,b'...clean record -Take pride in their appearance and work -Have good customer service skills -Willing to work on-call rotations -Drug free Please reach out to us by phone (708)250-5670 or email info...',"https://www.ziprecruiter.com/candidate/search?search=""clean record""&location=illinois","""clean record""",illinois,https://www.ziprecruiter.com/k/l/AAIHWInDVyb0jSwfn0QyXn_FZhgAei-Dil7FRuc-MTnzHD_P9-a-AMza-hl9hjHyfZtJ6ONe8DRBO0oyzmmKtumn2NVORRVvNCmOiOlTVLM0fOo_z5p603vhJXrtq0_ZsHgKF5mKjMyaoW4eIDDcOCtcVMKeXt9Q7YN_zr90JobbPjSSGje2a3wjKhW9RWi2
7588d97ebc8970c764dfcb902a156a3e,Certified Applicator,Mosquito Shield of West Suburban Chicago,"b'You must have a valid drivers license with a clean record along with a positive attitude and the desire to want to grow with a winning company. Must have people skills, ability to work independently...'","https://www.ziprecruiter.com/candidate/search?search=""clean record""&location=illinois","""clean record""",illinois,https://www.ziprecruiter.com/k/l/AALvJngapZPqsP-DZU9ResWGgOTtnvr8XDCSFDPZ0gYETHRwtV0oycRPGAFWtf5d-BUMw2btYb-VBfDVVeDLxTo_HdMTrd5QgXPomtBfqIG9lWcpZhLxgoyF_FdfFsGpTovLUoOXGt9NCSzhfIAOtPILHqWSoGI8i1lHPQ_g8KNpoTSnDNeocQepGkk2LY2n
8bdc4b908e99aacee08f83b5ebe5f7d8,Air Compressor Service Technician,"Compressed Air Advisors, Inc.","b""Valid driver's license with a clean record * Available to answer service calls outside of normal working hours on a rotating basis * Due to our customer base, there is a requirement, at times, to...""","https://www.ziprecruiter.com/candidate/search?search=""clean record""&location=illinois","""clean record""",illinois,https://www.ziprecruiter.com/k/l/AAKkXx46IXAPdop7QTDb9PYRb2kDbRYE7_dO48ybqDalj7uxyxgUKwfSAhoI7rWMwUMHvghs9nwp1ZBBXES2SaqH3bg1UpRVw6WPRL8WUTSduaY9C4KshOIQyWQ_WF7PPFoAWTXYmujOjU8n2rut-UmI3qi1nxSrCZAKU1OP68IEAKwJgRJbgtLpL2UG6iPp
3b3f2602bed46da71b7f7aeab8c2d38f,Turf & Plant Healthcare Technician,Chalet,"b""Have and maintain a current driver's license with a clean record, and be able to lift 75 to 100 lbs. * Outstanding customer service and time management skills. Pay & Benefits: * We have both...""","https://www.ziprecruiter.com/candidate/search?search=""clean record""&location=illinois","""clean record""",illinois,https://www.ziprecruiter.com/k/l/AAKFV8zbGO2CHUYTm39nhwjl9wc-vSVEGzdHgxz3yiulfbiFeN56R9g5txfziZQhft472bCQuVVO5y_DnRUNgosw_psi5-5rdmrCr0PQ6LETrwWX9lmy6NOyX9CcXGXOP5zGRD1IZhQwtrlF6VqDL4EEumyNHGbTMezAyGRPMJGmXR-txkRSSQQn1kp91_SC
e07cc1740bb308f6196e1fd43509d476,Class A CDL Driver,Jeff A Byers Trucking LLC,"b'Clean background, no felonies, be able to pass drug screen Experience with Qualcomm, electronic logs, and computer helpful OTR 4-5 weeks out with 8-10 days home We have all late model Kenworth, Volvo...'",https://www.ziprecruiter.com/candidate/search?search=felonies&location=illinois,felonies,illinois,https://www.ziprecruiter.com/k/l/AAI6WrCA2Pdo0bZslqx647-kxu37ay8LkA7-hUNkMj8uVFjFrZ4Hja-mIOkuwsNhi_ka4QLSjcjudzKd5nZ8F3GwgaKQwJHawvR83OMTpU-W26nH8fqqRAG_KYpv5qRUGeM79kIsTNgRppHGQ2qMlrO9RAiddOFYWPMk2MjYAayc8Wzbux_wjB8sps7Vg0w
9062e9c6875fa5c6aa6888439b1220bf,CDL A OTR Liquid/Dry Bulk Driver - South Central,"Brady Trucking, Inc.","b'Must have no violent, sex or theft Felonies in last 7 years. 7 - 10 years is subject to review. * Driver must live within KY, TN, MS, AL, AR, LA, GA, FL ""Built by truckers, for truckers"" means that...'",https://www.ziprecruiter.com/candidate/search?search=felonies&location=illinois,felonies,illinois,https://www.ziprecruiter.com/ek/l/AAJz66W37EPYvtJPY1CGlnx_N3M7YUBiCvZdaBI9raGyEqZ2Xb1nyb6MdiqAg2wsAxOJj0WHLhuyBv76sZj4hBSgwOPCPgS8nvbCQjwyM_6UgIReGjTgXnTOrQRosOtBGjjBkKCmLHuycDBUpDxZo4ZlTvmgZgB0qfPyD_wE_yS4RPPv7fnipHIaRV35Viw
8d9046b454f22477d13adcf175c33af5,CDL-A Solo Heavy Haul Driver,Combined Transport,b'No felonies in the past 5 years',https://www.ziprecruiter.com/candidate/search?search=felonies&location=illinois,felonies,illinois,https://www.ziprecruiter.com/ek/l/AAJINXNAp_6iLb7bP2qIQ_7o3F6rhbEKBlkWdYROG1bPZ0co_sv49CZr_W6tepfcnyyyGKjHgbXtcB_JmAp5sCdgpVgL6Fwwdj2ULUniKzh8FcD3h8DOkw8pEk0trJT9OMQbxqDFavMngJ98a8aWyMmiKFCITGAWHhIf0kPKydLtt4pPoh7TeIq4lMlu2rs
d7b0a3ced19efd161d11b2d446747218,FedEx Delivery Driver,Bright Flag Recruiting,b'No felonies / violent misdemeanors or drug-related misdemeanors in the last 10 years. * Physically able to carry packages of 100 lbs or more. * Able to deliver between 120-180 stops a day...',https://www.ziprecruiter.com/candidate/search?search=felonies&location=illinois,felonies,illinois,https://www.ziprecruiter.com/k/l/AALi4d1h5fktuee1jFyyMCaZi1XkwTNkTH-y-GvOM8BLaXzTdoorqbis4Glp_DuXhqTG9wb_OfdGFzO3i_TM1bY0Psyh3Iq8T-S0ehGllWSZA4kIR0uItzby5scifNm_pgzIhE8pmgmpJJjM7sTjvs4I5d89HHwt0ihw9LqXiyFjahW4Adeuc6qcSyoEPIY
eefd232784ac0bc02b07f7d74e7bd41f,Customer Service Representative - Remote,Lloyd Services,b'No felonies on record * Ability to build rapport with clients * Ability to prioritize and multitask * Positive and professional demeanor * Excellent written and verbal communication skills Benefits...',https://www.ziprecruiter.com/candidate/search?search=felonies&location=illinois,felonies,illinois,https://www.ziprecruiter.com/k/l/AALjojGyV2Ua-6FXCuPbSrxVUgPso2KbD0FQTnSeM7I_dqPJKE9HGPUb97reLMDGQ_9ZT5yx3HMnzt8VIwH7Dc64nweRZrmrXHVJWu0wZJLIxUM6nBCpgkqZnMkx00FFapsjUapwj-DE2HlE9U2MoxEuTuZ_p-R-SMgRIvBjIpuVmvS_hajZu4v_aZqtrWw
