job_id,job_title,job_organization_name,job_snippet_text,source_url,job_search_term,location_search_term,full_url
0964b6249c5c4cf5bdebc02c0a5adbe0,Chicago ARC Full Time Intake Clerk,The Salvation Army - Metro Division,"b'...parole, courts, etc.) + Assist in completing short form applications completed by alternate program staff in support of 24/7 intakes. + Follow-up with applicants that are referred to detox as part of...'",https://www.ziprecruiter.com/candidate/search?search=parole&location=illinois,parole,illinois,https://www.ziprecruiter.com/k/l/AAIPVCvoTv-GpouXOFRjaBHVjGo93OHTVRXpSU_pgPneeV1erxWcYhA0DdVoGXs2sxOYepHewjXdexPfaUNiZZFULkOxao5FzdVsv7rf8_awQsyTRDi_NXAPjQOX3KOuev7HF5wZ7pfe8HoUrvxVmPPkyXzbi_zxup1NNroKYKP0vK4wefIHv6c4vUOiOVk7
505b3ae3eede69e128ecfd0dadbe4281,Chicago ARC Full Time Intake Clerk,The Salvation Army,"b'Provide all required documentation to outside agencies that support the beneficiary file (probation, parole, courts, etc.) * Assist in completing short form applications completed by alternate...'",https://www.ziprecruiter.com/candidate/search?search=parole&location=illinois,parole,illinois,https://www.ziprecruiter.com/k/l/AAL2JJjdaMsFBX1NhMMaEvmCyJuc8U45VD9kQb7SswfqGzscOS85tFgoAp_IAjLv7LQ6oHSLK7qlM665QZgZmBid-JePzW9d7sccaicZanTDAVqDcKuww8VWSes1xcYKHuCcX1QNEnXtjVeth22IuZUZPMN35Fwbvb32wn-1L6z4PRsMJbG5YNzQSasAnMvq
edec569b4b1b07dc668645d8f6599066,Chicago ARC Full Time Intake Clerk,The Salvation Army National Corporation,"b'Provide all required documentation to outside agencies that support the beneficiary file (probation, parole, courts, etc.) * Assist in completing short form applications completed by alternate...'",https://www.ziprecruiter.com/candidate/search?search=parole&location=illinois,parole,illinois,https://www.ziprecruiter.com/k/l/AAKkrj1BuW9fe-q0oBzycAApgQ-CRrpjSs82qeb2hnvtprS6vikPnazFCuvVbbJ6lMVPQ1K9MTw1ZkHkwOiZ6TIPObpewymzzcFL9M8JyhsfeyPc20QRC-oSOf2zH2TgzoU7BKRhLIJYa9Xqxlt992YVIY88QR7iEg36vJDduBD5efUHXjybhjHBAzDp_doC
e2ae91331f8fa9067317a695866282dd,Police Officer (Pre-Certified),Village of Glenview,"b'Investigates any reported crimes by gathering, securing and documenting evidence, interviewing witnesses, recording and submitting pertinent information. Conducts surveillance when required'",https://www.ziprecruiter.com/candidate/search?search=crime&location=illinois,crime,illinois,https://www.ziprecruiter.com/k/l/AALj-sYCjvAFlLUuVZEJapvbOQAgX4tU_HjnLuocE0WlyppkdMGZxKR1F7AGdtGfdcwVNcrCW2zYzpltc4v2nQm8tyR1FMyuiOb2mnj9XnHD7pfrK6D1ok9utO3iSlJk6B-RISWWrIOVeVAoGIkYueRK5WOKhco3LLY7NHSwyBcp45iZkAA8H7VWjY-gFpc
4797a9af4601d379d108e7bb89a2b27e,POLICE OFFICER (Title 32),Air National Guard Units,"b'Responds to calls for emergency assistance to include active shooter, suspicious persons, catastrophic events, scenes of crimes/natural disasters and enemy attacks, and makes apprehensions'",https://www.ziprecruiter.com/candidate/search?search=crime&location=illinois,crime,illinois,https://www.ziprecruiter.com/k/l/AAJr0B5fe1J0FZ4-qww20woAxy7RIm1p8nSQv75ggvz_b7_NHGuHFKBRMrIE4MxI1JpBVG3iLAdLTP-mImYSWrTMYyv4CyVK-UwX0N-szeRWh7yhsWnCkRK1gzINZ0G-AmJ0pLUef-gG5Et8nyur6gdWAqqnqZyS9XBt5Z90_ZPioabg_OwBpST6iCzZbak
beb6db03006f1d756ee340ada6dff366,Police Officer,Triton College,"b'In addition, shall be charged with the enforcement of all laws and ordinances, the preservation of peace, protection of life and property, the prevention of crimes, and the arrest and prosecution of...'",https://www.ziprecruiter.com/candidate/search?search=crime&location=illinois,crime,illinois,https://www.ziprecruiter.com/k/l/AAImt452PyJJmAtqcf9Zw4FERIdGoP9I0vkA30b1oaKiTOhwHVVV-V1d7EGUhl-T793HpQNPDrtmWf7dKXFfKdrHKVC_wU4DxKYrPlv4hvHaV57LtiLPVnXN93z2SkOuM_a172lL9JBrxfoRYGBbONRcM9MTG8WgactbsZAExvsqL7u0pCXjJ1q07uVh_AUx
93ff62c973b2d8ed374c82b069b594f8,SUPERVISORY POLICE OFFICER (Title 32),Air National Guard Units,"b'Directs and supervises the dispatch operation activities involving security force patrols to scenes of crimes, accidents, natural disasters, and apprehensions. Directs or personally performs...'",https://www.ziprecruiter.com/candidate/search?search=crime&location=illinois,crime,illinois,https://www.ziprecruiter.com/k/l/AAKQG_AT0ZIv_js0Dql5JGCDtCLZ4WACyA0OBSvjqlU8NX2Uz1pcA4klQR4NEFKGDrK8WowYv5WdybuycdFxe9MwZdV_Rr36mS52fAsrOVcRl1QHeaFGeOfZyaOONxK16lOR-dDHZ_lQZyIjLXlviO8sweBx23VGJNhMEBzMDmAiZgeVVWlu9HAcw4BnmRCr
f3b57c313176cf24c4ae6964514aa5f8,Part-Time Peace Officer,Digby's Detective and Security Agency,"b'Part-Time Peace Officer Responsibilities include, but are not limited to: (Refer to Post Orders for specific responsibilities) To observe, patrol, enforce laws on property, deter criminal activity or...'",https://www.ziprecruiter.com/candidate/search?search=crime&location=illinois,crime,illinois,https://www.ziprecruiter.com/k/l/AAJi6BT_weJIPV-a3IPELmb-lU6m1buvkX_eAi7lIC24YMEfZTMCrYzvK63c4u3E9YX-CKN-MEIjXaHFxrjQdVpePlJIhmhT06xE3RheMlMbJCPtNNmOAct0kWatS3w0kLVOjY8693D6xFKY7h6SPfAl5kl9RzlJA1w3M9VuYgeB9fihOeNl8jdeWwATTFX_
6d963f9dd79732b6272334ac782ee38e,Security Professional - Company Police,Allied Universal,b'Education and certification of Company Police Officers includes specialized law enforcement training approved by the North Carolina Criminal Justice Education and Training Standards Commission',https://www.ziprecruiter.com/candidate/search?search=crime&location=illinois,crime,illinois,https://www.ziprecruiter.com/k/l/AAIcQ0kI-qkg63WblyTHJ1zkFDqrxL66j4sVufPCwGB9bySk-0g2KIm9yLCOf2VQK-RILzLZGWsfK_Cx9q80kTR9i1q0VglAUAphzFkW3OcgHrpuu2qX8mL_aaLYFrEm2t6z2Z1id2gUy33QWmrH9Qy6f8Mz5fU546xiR3vTBDxvVLyC2xP6sYExzE17p6NM
e68da83683c8baf87bc868cf1c232d06,Fraud Investigator/Auditor,Pharmacy Investigators & Consultant,"b""A Bachelor's Degree in Criminal Justice, Health Care Administration, Business or a related field is required. The candidate will work closely with existing clinical staff and combine the candidate...""",https://www.ziprecruiter.com/candidate/search?search=crime&location=illinois,crime,illinois,https://www.ziprecruiter.com/k/l/AAI3d1FCYCQ4WwvZujf-eNxhzm8WM0VebpCoveaGuZyDpayuRPjFtP3x6bT0ZnDrXJtrmEM3NbPmBYuWzyuOUO4mRjsAoPytDwuExmsJl6bDq6ufCP8zed7MU4yDMNEtwetL_A6VIqlWsqClwZEgYoZlFqIlPEe1iyKSGDQ_n-Pl8tTTZSWu5SPtqhvLsO4
d34828f083714c7d73d6fc38b582d3f0,Experienced Police Officer,City of Champaign,"b'...criminal activity within the community; compiling reports, preparing cases for trial and appearing in court, and maintaining records for proper documentation. If you have any questions about our...'",https://www.ziprecruiter.com/candidate/search?search=crime&location=illinois,crime,illinois,https://www.ziprecruiter.com/k/l/AAJA93ub2VR9qj28zdVcbq0QLXfbGR1YNZJ06Z9PDy76MU39S8-Cl3n4u5iPgIojwF6z6T1QbwzlG77DTt2MtkyuiJFfeMd41DhJ0ilyVZ-zABIa8xUD2r4hSNRJT2np2FPS04SRKIbUvod5eZwrdo4ru23kL5r1ZKb8wlU91LMfOzkW2GncMjHsZrkP3do
dd835c66574aa98a12e65ed1244ee79f,Public Safety Officer,Andy Frain Services,"b'Patrol physical property or maintain fixed post position, being diligent to report any suspicious activity and investigate accidents and criminal acts. * Monitor cameras or equipment in a continuous...'",https://www.ziprecruiter.com/candidate/search?search=crime&location=illinois,crime,illinois,https://www.ziprecruiter.com/k/l/AAITV0BDhXVSQRVeYe1ly9X6tS_ADzTuBvfKypi4SoOP6BhsahEfgTjK1WCU-BFz7G_jJ9GthVd1PfFQv0Z4nB8-D-QGGkroAYO6NiMFovBegtsjMZBH1brtg1e142G6hvkQcq_TB39lvlnAyuBBTcEwx4vVGmlb1JKH0cVHXVPGSTeFpdqNcX1WKvC1Rf0
83b630b4e2cdd348ec75f1a55595f11a,Police Officer,Metra,"b'Performing preliminary criminal and fatality investigations, and patrolling rail yards, stations and other locations driving police vehicles, riding trains or bicycles, or walking. Locating victims...'",https://www.ziprecruiter.com/candidate/search?search=crime&location=illinois,crime,illinois,https://www.ziprecruiter.com/k/l/AALMQ5Zd6TddTxxVcw9_zoE5PNx8dm9GFon07Q4svZ76lgtTea2yE5WTyjoM5gXKuKuKMLp6AmpO6a0hadl-da1NYogFn8bRMZy4ADI0CMum7xiSwlbTbG4GDKJH3ZCKbUcVeLsuSUw3V4gTLaxKEJUly6BG1FpA3uzqEzLlj_KUOIT0kp4_U9i7OfSfXFg
22edf76f5ec6b742f9ccfebd03359e8b,Loss Prevention Agent - Marshfield Plaza,"The Gap, Inc.","b'The Loss Prevention Agent ensures the customer experience through providing a ""Crime Free Store"" by making safe apprehensions, deterring internal and external theft, as well as, assisting in...'",https://www.ziprecruiter.com/candidate/search?search=crime&location=illinois,crime,illinois,https://www.ziprecruiter.com/k/l/AAIMfZOF_hghFF6PsAo_MspRoQx1kwglwbjp7pmQG1pvwNi45Db0Z8kZUkKEuTc8MuIpdMkX4ZXVahWnulMQyjmqprrLokSya4JEqlsAVG_o9kwsDcRpH2swJyj0p7FpZlFBDAXE6m51nKygLNVyigZfWom0i4qEx1MlVJpyJCLRioWzCMG1Xd_eJk-inyKm
75fef0892df322f0a255dbfb23cba550,Sr. Business Analyst / SME,Oracle,b'Our market leading financial crime and compliance software suite is used by leading financial institutions globally and underpins Anti-Money Laundering and Enterprise Fraud systems at some of the...',https://www.ziprecruiter.com/candidate/search?search=crime&location=illinois,crime,illinois,https://www.ziprecruiter.com/k/l/AAJQqRdeJxDTfyqMcNQLI5WeQV8w4hnXdn8N_xPixw2RGkFcWT9i8Z3M2J7ABSv7J4l59LXidWYFHjK07Lbgvm2K7TXsy2jtpJrFxLl5mD5sgNoJDcWRZkOL-zNxmBgFwodMAqXDHTWuBuKz9wi3IZ939g6G0AE1jBh-ohuLLUUxeFyDKbg5d3kiUY0cS-WN
0f7cb6cfc5d56fac293f4b493d45eeaf,Member Services Associate,National Insurance Crime Bureau,"b""Position Purpose: Contributes to the timely implementation of the Vice President's duties and assists other departmental team members in order to support partner engagement and membership initiatives""",https://www.ziprecruiter.com/candidate/search?search=crime&location=illinois,crime,illinois,https://www.ziprecruiter.com/k/l/AAIPhVrFqyhIwLRuSro_esSfe-X126XM5eTlJDvfZjHkMNDn2tPWcIfnu9d6K5Yd-3hvyyhnnwryz53IOtvHY-l1nkpSZMctKyJ0ynRrF9m_khZQGqzUJo4yI0-Jjh49p4rlQAVLMUpA6ldviEw-2gmPF2SYbd8QTkAPVf4EsTvG5ktNfEkVY5IjjtYbN-mb
fc96e756ee29981cf87a3cdc94c29914,"Sales Engineer, Senior- Financial Fraud",Fiserv,"b""The position is in support of Fiserv's Financial Crime Risk Management product portfolio, with a particular focus on the full-range of fraud detection and anti-money laundering processes and...""",https://www.ziprecruiter.com/candidate/search?search=crime&location=illinois,crime,illinois,https://www.ziprecruiter.com/k/l/AAKhiYcArumdLWfyWWdd1hykOtQ4Ums3g8RHhDVc8ykOsP20DQW6au01bUifDMl92frfziEWSX24vVr2bgH3SgCcZsD4sIf12mU1GmxHoRRhfkInhzv0qoaE80z4mvl5zj-zIwfPul-bGRkaIVCfEWDUt-o0VhiWh4gda5NGLO0RrZCY94p6bwuTInEIQnE
3b5bd4e0284437966b395100630fb7f7,Paralegal - Healthcare Fraud Unit - Criminal Division,CACI,b'Paralegal - Healthcare Fraud Unit - Criminal Division Job Category: Service Contract Act Minimum Clearance Required to Start: DOJ MBI Employee Type: Regular Percentage of Travel Required: Up to 10%...',https://www.ziprecruiter.com/candidate/search?search=crime&location=illinois,crime,illinois,https://www.ziprecruiter.com/k/l/AAJKI0BEUY1xskPcrmBPhUIKQjSVooY1VBTP4buBTlxhzxLMM3RZ4vZMNJn68H6qgKrkCMYECnNp7-AteYud-QDFlGj88W1jLvoGRK2Ki6dPA4_jeWczWaiq93NJ8n1vIVcjM4KXbXwCRnCrbyjzVHAqyiPgYRdeRHM55qOdhGiL4Bcksw4k6A7y2uFzUEk
224ad24ee5b38746ff244987b790e8fc,"Senior Claims Specialist, Fidelity/Crime",AXIS Capital,"b'This position will handle primary and excess claims involving Fidelity, Crime and Fiduciary claims. Note: This position can be based in Berkeley Heights, NJ, New York City, or Chicago and will be...'",https://www.ziprecruiter.com/candidate/search?search=crime&location=illinois,crime,illinois,https://www.ziprecruiter.com/k/l/AAL_FKzBYctAXrm-v5CEr1zgdt9vieSnPhZD_2ZS_sNwQDizGV2VfEaYqnTbRRSitLKGYrijhp-oCbBRQUzwkHWocXqhVPCJ69pv4WzXeq81OSRCbdg23aeJbjQmblLMN4TYXUxTBA34LmO8rj79o-NA_xNKo89RNqS4EV708fSmt2foSxfyj9GNJBDjth8
d2545d082bbc94101682b2712381bde2,"Crime Scene Cleanup Technician - Oswego, IL",Aftermath Services,"b'Crime Scene Cleanup Technician Location: Oswego, IL Aftermath has an immediate need for a Crime Scene Cleanup Technician. If you are passionate about helping people during times of tragedy and enjoys...'",https://www.ziprecruiter.com/candidate/search?search=crime&location=illinois,crime,illinois,https://www.ziprecruiter.com/k/l/AAKNGVIAQs1s-_QZba90lmEXCtcANMbXJLvwc72HgFg2qs40Lu80ODBUxPofyM8p3P8JdOlyL6hDI_EDUVIIT51GaW9t2PRN3e4KYgwLIhg625HoIrQel5lnLWLN0Ia_Qm3EXcQU_Zf6l-Hxroemovv7gh0v8RcqbAYh-iVSSJ3nqeetVdYUzNe1n2hAMj0
37eafa264c19af315f7f76039990a47c,"Delivery Driver/Courier Full Time - Swing Shift DOT 10:00am-6:30pm, $20.75 per hour plus benefits",FedEx Express,b'Factors to be considered concerning a previous criminal conviction; presumption. 754. Written statement upon denial of license or employment. 755. Enforcement. 750. Definitions. For the purposes of...',https://www.ziprecruiter.com/candidate/search?search=crime&location=illinois,crime,illinois,https://www.ziprecruiter.com/k/l/AAI3Gmz29T3XGZWwltwQomJRNn8M77GwYuwW1kbBfGPeXANs6qI8SwTSo8d3mQ0HbkBuiQrXqY7wJtpAdqJ59W4LBWsorIQAy2syRj0Fg9ju64C5gjc59Wrguj625GPNC2aUWM9DE_RSFOFoZbdRIGdaXUT_Qpjjwltyg_zFZq7ZyVdXKdk9kj-axmvpbzU
f9cd4be36cef0a1ab3ee07d881fb5c5e,Security Assistant,"Veterans Affairs, Veterans Health Administration",b'SummaryThe primary purpose of this position is to initiate and carry out a variety of complex duties; such as monitoring and directing Police Officer response to emergency and non-emergency criminal...',https://www.ziprecruiter.com/candidate/search?search=crime&location=illinois,crime,illinois,https://www.ziprecruiter.com/k/l/AAI3duW8-igbG3sZ2-PBjcIg9M_bYfJV9pzc2u6leRReVzsQfzjZbFVxNB67lLqFvlej1Pc_nOyn5xrCpSLpwRBIjq_lwtSiRSEiaspm8Q7kp1Kahvukwwv9QEeGABQjtkM3kVeaSe7pAqBW7Yx1BgEpXO2TPfDYAje4agDt6N3M9zWyybGkdwuPjh0QNunp
fa4e3c6fb7219b20f581d972ab0bc293,Card Fraud Analyst II,Citywide Bank,"b'Join a team that makes ""Great Things Happen!"" The Card Fraud Analyst II independently reviews and investigates financial crimes at Heartland and its member banks, including debit card fraud, credit...'",https://www.ziprecruiter.com/candidate/search?search=crime&location=illinois,crime,illinois,https://www.ziprecruiter.com/k/l/AALa41pSDq4O4_i7V6jzP0F5_fEGFGWDE88UDONPUBggqkvQR4SnwUNLeJZn16ZJuOscOf2W-ckN4dQIrnhyFgGtLxx80t5Q2TLuRi7NuHbgIwHXyCCaPO7FGE0Drot-vwNosqajAnfYIdUCzp_AP9EzByFrPUf5fFmRJBTXLT6YfdB_eWjcUaY4bKE52pJk
86c5f3e66788d89dec7a6aa1e777c344,Asset Protection Investigator,Abercrombie and Fitch Co.,b'...Crime while partnering with Zone ORC Investigator and local law enforcement Complete special projects as assigned by Regional Manager of Asset Protection Qualifications 4-year degree preferred. 2 or...',https://www.ziprecruiter.com/candidate/search?search=crime&location=illinois,crime,illinois,https://www.ziprecruiter.com/k/l/AAJd9XBqTIE4mhkw3zUOWYN0PRxQig6LBJVzV1NKRACUkuDSu0FGbvBG2dVuTLpuD2Vu6hvHygvVZaJEMrlJT9bZIHM0W6VNlD3SFKA88zlnV6qncN1YqlI-41XtFheau6fzePIkWam-6MuIznu7qoh62jcIFU4-MD0pnDopBjwK8AB8j-EtdSLd-tB17GHz
9b5c83e7060e4ea8c93e1dc673b40a77,Senior Management Liability Underwriter - Remote in the U.S.,Crum & Forster,"b'This person will be responsible for the underwriting analysis and development of a profitable book of Management Liability and Crime and Fidelity business, inline with the strategies set forth within...'",https://www.ziprecruiter.com/candidate/search?search=crime&location=illinois,crime,illinois,https://www.ziprecruiter.com/k/l/AAJYO9VEXWLHq6DS4TRQ7-isY6Q3r_M2mH1_8HDL4KPYjQz_fysKpW-rwdvUCB2a86w-jVgWXxiR-YcBu2Y34L7tsmbGGswk9709q-lAB0ZwJtD2nLKEOENO_Rk491NqbX9cVljthV1z58MURICbUbr5f_6LPGlg0JKtCO3wh0ZoczU0BrDvgIGFY9a0QDMB
973328f50626a793afdf0a179d1c0071,Associate-Business Development,Moody's,"b'For San Francisco positions, qualified applicants with criminal histories will be considered for employment consistent with the requirements of the San Francisco Fair Chance Ordinance. For New York...'",https://www.ziprecruiter.com/candidate/search?search=crime&location=illinois,crime,illinois,https://www.ziprecruiter.com/k/l/AALcTeD2yvRxb9_ORsV4CIpoMvK0bWCVpsftDqyg8C9xfCuL6wy715Ol0116kp14tnxRJr1bbod0BWPsDFxUYaXMHUCB7r1ZoNsmW-8IetzW1Vfj0xCFOLjm5YungntNsQcZoNy9pmiAMYBk6OCjkgZoeyy94EylrtOIwZy7ZKIp4XdoQSngXMlc9DAUTa42
7b7abced963cf0974843be6c0856108e,Captain,University of Chicago,"b'Career Track and Job LevelPolice & Security Plans, develops and oversees a variety of campus security programs, including crime prevention, police personnel training, and criminal investigations'",https://www.ziprecruiter.com/candidate/search?search=crime&location=illinois,crime,illinois,https://www.ziprecruiter.com/k/l/AALM4GyrUp9I6bNlgsnRlneFYPGsBBuhPcownyke6tUZESs83V6ThFyw0NLKIW6PasosYqCBZVEKKExmN2a0yR8ew35RjCyrft2JpQ5PlrLRdeaZpbvcyJl5mJ1Wz2yYzK55Dyj1EuplvkXxZPo3x3LiHzED387nYUqm_6uWpYIYve3Dam0xCDsFRU3Jc3JC
7387f32f21e45af3ecf709305a0872da,ATTORNEY SUPERVISOR (OFFICE OF THE PUBLIC DEFENDER) - D05,Cook County Government,"b'Minimum of three (3) years of experience as an Assistant Public Defender -OR- as a criminal defense attorney, two (2) yearsof which are related to legal matters of a progressively difficult and...'",https://www.ziprecruiter.com/candidate/search?search=crime&location=illinois,crime,illinois,https://www.ziprecruiter.com/k/l/AALYzut5dmioZhQkQrvG9FCO2J-dalC41KGtJo_5c21swtiw0VmasECfhCxBfGqCabW78Hlt6C0hgw2ADYkyKrSDN8Yy8g2HRGuYyjnC255nx4jpcMvsOqIUwzUnOkYdp5b0e9fJantJm1VablsSX9iRsRibU71aHviNWKXz4j9mPMkQPct_JyPtjECyLP2g
6b152b1baa04e829400bbdb466b6dd0a,"Security Officer, Harvard, IL, evenings, nights, weekends, 16 hrs/per pay period",Mercy,"b'...crime and prohibited activities by patrolling the buildings, grounds, and parking lots of Mercyhealth to detect any irregularities. Inspects doors, windows and locks to ensure a high level of...'",https://www.ziprecruiter.com/candidate/search?search=crime&location=illinois,crime,illinois,https://www.ziprecruiter.com/k/l/AAIPBUdB1-L1U373tcIRc1onCV3RYcQzVsxz6ro5sGh1EOsY0GPlA7VVPwgqnEMdj18EI2gXlgch0ONTXj-kx8R3ZDdOO7mwk0Q1NhCCL4Hc8jSnBXy4zxktskKoF4Tj77fJJPYK-tVtDfavbbR4VXGvimU9pdJL8QxFOwv7VfHPGaMKC4xSDEhnRpk5HEKe
1d908e51a371d0d5a0554a9e4d8dd1cd,Security Professional-Flex Officer,Allied Universal,"b'A Security Flex Officer acts as a visible deterrent to crime and client rule infractions and detect and report suspicious, unsafe or criminal acts at or near their assigned posts, which may be a...'",https://www.ziprecruiter.com/candidate/search?search=crime&location=illinois,crime,illinois,https://www.ziprecruiter.com/k/l/AAIGi8HXSk6tMxK0DtoYpM4EirWfyPb4ut7_Yg-xa9_jk7W3S_lrn0rVbn_f9v7ZETrTtPU5FbYx-zqPM_GVJ7aSrdbleoECVZ4hYCvNDkqjRfQkY3HpZkg9Y-RCuvl5cD33r6Tpbu_KDDbr9CKkvlxR6qnUplO6WRQ2xIIpaNJTnlfrRjtyzth7V1gdDLl1
464ee778fe904aa4b44b2aa01c9f69f7,Experienced HVAC Service Technician,Service Express Heating & Air,"b""Must pass drug and background check prior to hire. Normal and on call hours apply. Year round work for all of our employees. The benefits of this HVAC service technician's position includes""","https://www.ziprecruiter.com/candidate/search?search=""pass drug and background check""&location=illinois","""pass drug and background check""",illinois,https://www.ziprecruiter.com/k/l/AALr1kiBIrXmRDfI_VAJpQR8iu6oYnpIHF8PDveJelPBb5roe4IqjywEMk9JRxn7MLSOc13v7Ddrk6_yFNVE2utb50WFvzjDDfUH13_uY2IEcqmlyJpLL5BdtS2yJcp2g6h2HbKnmQT_0xBoIjzLCH0oX02zyee1LjNy9abC_RpAZJHnQsU2_5Wi78I4ovs
3488d62770f839a29408743c7ce6e238,Journeyman Electrician (CHICAGO),"Facility Solutions Group, Inc.",b'...pass drug and background check. + Ability to multitask while staying organized + Strong verbal and written communications skills + Positive customer service skills + Experience in lighting a plus',"https://www.ziprecruiter.com/candidate/search?search=""pass drug and background check""&location=illinois","""pass drug and background check""",illinois,https://www.ziprecruiter.com/k/l/AAJaKE4OjVK0MQ8Gsd5FNXI1xpFgeFM6_8EIVcT0imxnpYCSt0KfujUiUaA6tEcQDCiuhBKUOsv7Wrc03DClVxla2CnagnwHBFnt-fm-ovfVWl0TVSiJdFaSaMC5dnrHUC4TaY-g09C0Ydv0SD2ZNESEY_cAXelmwgHB0pcFTuURtcMV_521S7WMYhAkWp8
13f41450b9d5be32841855b6f7cd554a,Regional CDL A Truck Driver - Car Hauler - Earn up to $100k/yr,Cassens Transport,"b'Valid CDL (Class A) or graduate from certified truck driving school Able to work weekends Willing to undergo and pass a background check, physical and drug screen Able to work in the United States...'","https://www.ziprecruiter.com/candidate/search?search=""pass a background check""&location=illinois","""pass a background check""",illinois,https://www.ziprecruiter.com/ek/l/AAJfvFMb3ufAZMhy3Eiy1D2UtuvqwoSGvi-HWmeOmNgnaDM_0cO0ZyqcLHPNH7EIRRKP5CrenRD_2_Gy9Tdxp5GTD5F9iVFdIQp9mKaSm02LKtP3UBE-GcIWfWEDyxW5Nwt4mxQEdISHxB3zoRugMRZnuOiU-x94F6BE-h0A3GP1UIOB1UgMnv5Ypq0GIsE
3c331db923f59b3708252eb4219d2a38,Driver Trainee Earn Your CDL A,Keurig Dr Pepper,"b'EOE Minorities/Females/Protected Veterans/Disabled Candidates must be able to pass a background check and drug test, as applicable for the role.'","https://www.ziprecruiter.com/candidate/search?search=""pass a background check""&location=illinois","""pass a background check""",illinois,https://www.ziprecruiter.com/ek/l/AALsHBPSk_u8XjdLc1RhkszEcEEdspPaJwCTdzjQ7SYeUtYzZLmni9OVfYSWt4nEF1T91pmqO-4ret90O3eJ9kD2F1cuixi7Gj8A-3CJuK-Sird3UQrV2iee5Hj8LidKByCTKpEJfm-HlCOUCKoY7WHfsljTOj8b1jK0QEGgIdtxk53EHX1fEzR7Y6nLC0M
3dfab1b963f1267baf8f52ad1bba211a,Groundperson,Asplundh Tree Expert,b'Must pass a background check and pass a motor vehicle records check. * Must be able to pass a DOT physical in order to obtain a DOT medical card. Physical Requirements: Key: Rarely = less than 10%...',"https://www.ziprecruiter.com/candidate/search?search=""pass a background check""&location=illinois","""pass a background check""",illinois,https://www.ziprecruiter.com/k/l/AAIuPLQSuTghVS18_jZbhIAhy9lwa4fmL4oDLHIWrgf37J_G9Tjosi04qQS1mTKmkygjclUaZxilrrKNc9D8CqQbSBWb3Qxw-8wnLX7qix3TiFXkbqkrGi2q25qqNVoFKa3r4PzjXhRa4On9gmQMoMuvFltwy-XUrSuW1hMB6Ciq78aP3jNeOpeIFtvErRw
3d38dcb552acb529dec302ae7a65a714,Diet Aide/ Server,Thomas Cuisine,b'Pass a background check * Food Handlers Certification preferred',"https://www.ziprecruiter.com/candidate/search?search=""pass a background check""&location=illinois","""pass a background check""",illinois,https://www.ziprecruiter.com/k/l/AALs8BEPMRt_K-3zOL3cLgj7FYuD_8kVf8EYbZJP64fh2YMzMcvYjKA0Phc5vMm3HsBkFOcpKM0-jNwkngwlesnwSM_VQSJqnAymY11zYGJZ-1l4O4MQMONxMr7-P3FWZj9hdFaSxbpUavsZEVDhtgoFuCHbilSkAnv3scWVh15fOuzHG48Sl_3TMO9B0JI
e12cd5597fff5d2796aecfeff1171d4c,Field Service Technician (Part Time),Lucky Lincoln Gaming,"b""The successful candidate must be 21 years or older, have a valid driver's license and good driving record, strong leadership skills, and pass a detailed background check with the Illinois Gaming...""","https://www.ziprecruiter.com/candidate/search?search=""pass a background check""&location=illinois","""pass a background check""",illinois,https://www.ziprecruiter.com/k/l/AAInc5byX0TOsa057zC-2aU2eZoM406EIaVZI9a360kZqHJ6LhSKwZwuQVh47HkdtkdHSwW0Qlu_Lwgh-oJoXCU6F3dqVgej5pLriqxKMC1xCBAUoz-EdLtcbTtPrXyuDdSCMY9ata6a0BpkpMIJWrciiVKCia9dZ4Mjwpz5X93B4_d6Jg9Ayg-uwNByM-8
b783dd7d7b2ce8d402c535ce108875c0,Truck Driver - Lowboy Operator,Asplundh Tree Expert,b'Must pass a background check and pass a motor vehicle records check. Physical Requirements: Key: Rarely = less than 10% Occasionally = up to 33% Frequently = up to 66% Continuously = 67% to 100...',"https://www.ziprecruiter.com/candidate/search?search=""pass a background check""&location=illinois","""pass a background check""",illinois,https://www.ziprecruiter.com/k/l/AAIqIPI64oL1My0FONcSPvo5OPnR4I1GN1EgrmoU0si7J4WdSAXH2tkNZYux76eD4ITKfZTDTKZFTdqsKMZf4GjG3rJrQ9W2eZW9Soe--27Bvt5AUtRisFvAt6pKMF-y5h20MsPxSJNgUsfkl5PTFPV5lZq3MF1okfrrvYa7o9GhpzG3jLgCoxijy4DvO-s
9c254d73fed8573b97235135958d6532,Outside Sales Representative- Roofing Sales,Roofing and Restoration Services,"b'...pass a background check. Benefits after 60 days include medical, dental, short term disability, long term disability, life insurance, voluntary life insurance, and 401k with company match. Submit...'","https://www.ziprecruiter.com/candidate/search?search=""pass a background check""&location=illinois","""pass a background check""",illinois,https://www.ziprecruiter.com/k/l/AALcV4TqH4Wv-0bA0YJ0D-jZo7llVGROPIHL9rA_3xkQ9vtz7ccRaVfnSqBHIUjMhLWl1oVuNNf8w7hiYSSzmgXBjSWuF4OfX0hJukBMrAW9WT8FrcT1in2VnGCsANjPAAscAVQyTu-RW9b9U72ANC8tCs0aoPP6-x_fsnPb0NQxl4CuJIiVOHSUCl5P-dc
3a3f4ef47fcd37a844e2c0a3158ece55,Have a Car? Want Flexible Hrs? Amazon Flex,Amazon Flex,"b""For more information visit: flex.amazon.com Or download the iPhone or Android app You must be 21 years old, have access to a car and a valid driver's license, pass a background check, and have an...""","https://www.ziprecruiter.com/candidate/search?search=""pass a background check""&location=illinois","""pass a background check""",illinois,https://www.ziprecruiter.com/ek/l/AAJatWplcb-IGK4CPdrFTzENDiJpYldhjv0LjUSCB34Uv2s4pobtAQtH4aOpCOly0GHCUZxfa7aZbw7f4Umu_l8CSILrPURiiGevkCMDuSpz9yrTo71hnS7NXnWam39LKl9xDeU_lTPAOlkpXmcXFqN65gPPUgqLZosDCG-OshU1_frRtlZPw_DxREo8hXk
4d3680c10e65f3efc18cfface5ff958b,Warehouse Workers,HR Metrics Minooka,b'Must be able to pass a background check and drug screen Must be able to pass hands-on certification of the Ride-On Electric Pallet Jack Must be able to lift up to 50 lbs repeatedly Must have Open...',"https://www.ziprecruiter.com/candidate/search?search=""pass a background check""&location=illinois","""pass a background check""",illinois,https://www.ziprecruiter.com/k/l/AAJ3gBlEMhGiMylsYFKRfA6e11_fDXTD48pUcIjYKLzTNSlYEn3X4MIvBMiT0RxdcEvkoC3fnD8S-rnT7LVBcM5ODVsELpgH-uK85SEtYH_aNnJUhJ6_3vmuJl8f-aS-uRw2wpyyh44N_uWnjw-Iz-z4ESRf5MWM9Y15-AEHrtoDCKilAlvXdBtJVm2Ma1k
